chapter	content
1	1. Reichsaußenminister von Ribbentrop zu Besuch in Budapest, Ungarn, 08.01.1942 Einfahrender Zug. Reichsaußenminister von Ribbentrop trifft zu einem Besuch in Ungarn auf dem Bahnhof in Budapest ein. Er steigt aus dem Zug. Empfang durch László von Bárdossy, den ungarischen Ministerpräsidenten und Außenminister. Ehrenabordnung der Auslandsorganisation der NSDAP. Fahrt durch das verschneite Budapest. Jubelnde und winkende Bevölkerung mit ungarischen Fahnen am Straßenrand. Von Ribbentrop steigt aus dem Auto und wird begrüßt. Jubelnde Bevölkerung. Kranzniederlegung am ungarischen Ehrenmal für die Gefallenen des Ersten Weltkrieges durch von Ribbentrop.
2	2. Göring und von Bock im Führerhauptquartier Wolfsschanze, Ostpreußen, Deutsches Reich, 1942 Reichsmarschall Göring trifft mit dem Zug im Führerhauptquartier ein. Er steigt aus, wird begrüßt und begibt sich mit Gefolge zur Besprechung. Generalfeldmarschall von Bock trifft mit dem Auto ein und wird begrüßt. Auch er geht zum Führerhauptquartier. Hitler empfängt von Bock.
3	3. Auszeichnungen im Führerhauptquartier Wolfsschanze, Ostpreußen, Deutsches Reich, 31.12.1941 SS-Obergruppenführer und General der Waffen-SS Sepp Dietrich begibt sich zum Führerhauptquartier. Dietrich erhält von Hitler das Eichenlaub zum Ritterkreuz des Eisernen Kreuzes. Er bedankt sich freudig. Hitler und Dietrich unterhalten sich (kein O-Ton). Major Weiß, Major Hitschold und Hauptmann Peltz auf dem Weg zum Führerhauptquartier. „Auch sie erhielten in Würdigung ihres heldenhaften Einsatzes für die Zukunft unseres Volkes aus der Hand des Führers das Eichenlaub zum Ritterkreuz“ (Sprecherton). General Bodenschatz beglückwünscht sie. Anschließend gemeinsames Kaffeetrinken und Kuchenessen. Am Tisch sitzt auch der Flugzeugführer Hitlers, Flugkapitän SS-Oberführer Baur.
4	4. Anfertigung von Schneeanzügen für Soldaten der Ostfront, Deutsches Reich, 1942 Weiße Tarnanzüge werden zugeschnitten. Blick in eine Nähstube der NS-Frauenschaft. Einzelne Näherinnen. Frauen bei der Arbeit mit den Nähmaschinen und beim Nähen. Frau im Schneetarnanzug. Männer bei der ersten Anprobe. Junger Mann im Schneeanzug umarmt eine Frau. Die fertiggestellten Anzüge werden verladen.
5	5. Letzter Tag der Woll-, Pelz-, und Wintersachensammlung in Berlin, Deutsches Reich, 1942 Hitlerjugend mit Schildern, deren Buchstaben sich zum Schriftzug „Die Ostfront ruft und wir alle geben“ zusammenfügen. Laut Sprecher wurden 67.232.686 Stück Wintersachen abgegeben. Transport der Sachen mit geschmückten Pferdeschlitten zu den Sammelstellen. Männer tragen große Säcke in die Sammelstellen. Frauen arbeiten in den Nähstuben der NSDAP. Einzelne Näherinnen, darunter alte und junge Frauen. Anprobe. Abtransport der Kleidung zum Bahnhof. Fahrt der Lkw-Kolonne durch das Brandenburger Tor und entlang der Straße Unter den Linden. Verladen in Waggons. Fahrender Güterzug. „Mit dieser Sammlung hat das deutsche Volk auf‘s Neue seine Entschlossenheit zum Kampf bis zum Endsieg bewiesen“ (Sprecherton).
6	6. An der Kanalküste und Minensuchboote auf See, Ärmelkanal, 1942 Karte von Ärmelkanal, England und Frankreich. Sturmflut. Uferstraße ist überflutet. Lkw und Pkw fahren durch die Flut. Sturmgeräusche. Minensuchflottille bei schwerer See auf Fahrt. Das Zeichen der Flottille. Auslegen eines Suchgeräts. Sprengung von Minen. Detonation. Eine Treibmine „wird durch Beschuss unschädlich gemacht“ (Sprecherton). Beschuss und Detonation. Markierung des geräumten Gebietes durch Bojen. Alarm. Matrosen laufen zu den Geschützen. Laden und Abfeuern der Artillerie. Beschießen britischer Schiffe. Einschläge. Artilleriekampf.
7	7. Herstellung von Transportschlitten an der Ostfront, Russische Sozialistische Föderative Sowjetrepublik, Sowjetunion, 1942 Karte des Raums vor Leningrad und des finnischen Meerbusens. Soldaten schlagen Holz. Transport der Stämme mit dem Lkw zum Sägewerk. Gefangene bei Verladearbeiten. Bau von Transportschlitten. Einzelne Arbeitsschritte. Selbstgeschmiedete Eisenkufen werden aufgezogen. Ein fertiger Schlitten wird mit einer Panzerabwehrkanone beladen. Eine Kolonne Panjepferde zieht Schlitten mit Nachschub auf dem Weg zur Front. Feldpost trifft ein. Verteilung der Post an die Soldaten. Die Speisekammer der Kompanieküche. An einem Baum hängt ein Stück Fleisch. Soldat schneidet ein Stück Fleisch ab. Essenträger gehen in tiefem Schnee vor und treffen bei einem Posten ein. Soldaten in der Schneehütte beim Essen. Wachposten steht vor der Tür. Zwei Soldaten gehen in Schneetarnkleidung mit Gewehr über die Schulter durch den Wald.
8	8. Straßenkampf in Jewpatorija, Krim, Russische Sozialistische Föderative Sowjetrepublik, Sowjetunion, 1942 Karte der Halbinsel Krim. Straßen von Jewpatorija mit beschädigten Gebäuden. Beschuss. Infanteristen durchsuchen einzelne Häuser. Beschuss mit Maschinengewehr (MG). Leichen auf der Straße. Ein totes Pferd auf der Straße. Soldat beim Rauchen. Einsatz von Flammenwerfern. Ein sowjetischer Soldat ergibt sich mit erhobenen Händen und wird durchsucht. Infanteristen gehen in der Stadt vor. Rumänische Artillerie im Straßenkampf. Artillerie beschießt sowjetische Stellungen. Detonation. Hafen von Jewpatorija. Zerschossene sowjetische Zerstörer sind gestrandet. Tote am Strand. Eine Kolonne sowjetischer Gefangener wird abgeführt.
9	9. Kampf um Sewastopol, Krim, Russische Sozialistische Föderative Sowjetrepublik, Sowjetunion, 1942 Artilleriemunition wird in Felsenbunkern gestapelt. Vorposten im Kampf. Schwere Artillerie feuert. Laden und Abfeuern der Artillerie. Infanterie in Bereitstellung. Sowjetische Tiefflieger. Flugabwehr. Infanterie im Kampf mit Karabinern. Soldaten nach dem Kampf. Gefallene sowjetische Soldaten. Beschuss auf Befestigungen von Sewastopol durch schwere Artillerie. Laden und Abfeuern der Artillerie. Einschläge. Sturzkampfflugzeuge (Stuka Junkers Ju 87) greifen an. Stuka im Flug. Bombardierung sowjetischer Stellungen. Sturzangriff. Landschaft bei Aufnahme aus Ju 87 erkennbar.
