chapter	content
Vorfilm	Die Division des Reichsmarschalls Eine Abteilung der Division „General Göring“ marschiert durch das Tor der Hermann-Göring-Kaserne in Berlin-Reinickendorf; Soldaten singen beim Marschieren; verschiedene Gebäude auf dem Kasernengelände. Das Ärmelband „Hermann Göring“. Reichsmarschall Hermann Göring begrüßt die vor Kübelwagen, Lkws und Panzerspähwagen (Sonderkraftfahrzeug Sd.Kfz. 222) in Reihe angetreten Soldaten. Eine Panzerabwehrkanone (7,5 cm PaK 40) wird vorgeführt. Manöver im Gelände: Soldaten sitzen auf Schützenpanzer (Sd.Kfz. 251) mit leichter Flugabwehrkanone (2 cm Flak) auf; Fahrt mit Motorrädern und Fahrzeugen auf einer staubigen Straße; ein Halbkettenfahrzeug zieht eine 8,8 cm Flak; Einsatz leichter Flak u.a. einer Vierlingsflak. Soldaten in Sturmbooten landen an einem Flussufer; Einsatz von: Granatwerfern; Maschinengewehren (MG); Handgranaten; Flammenwerfer; Artillerie (Flak und 10,5 cm leichte Feldhaubitze leFH 18). Panzer III und Sturmgeschütz (StuG III) feuern und rollen vor. Ein Soldat wirbt um Freiwillige für die Division General Göring.
1	1. Staatsakt für den verstorbenen Hans-Adolf von Moltke in Breslau, Deutsches Reich, 1943 Trauerfeier für den verstorbenen deutschen Botschafter in Madrid Hans-Adolf von Moltke im Landeshaus von Breslau: der aufgebahrte Sarg ist mit einer Hakenkreuzfahne bedeckt, eine Uniformmütze und ein Säbel liegen auf dem Sarg, daneben stehen Ehrenposten, im Hintergrund stehen Fahnenträger. Die Kränze des spanischen Botschafters und des Caudillo (spanisches Staatsoberhaupt Francisco Franco). Reichsaußenminister Joachim von Ribbentrop spricht den Angehörigen sein Beileid aus, im Hintergrund der Gauleiter von Niederschlesien Karl Hanke. SS-Ehrenposten legen einen Kranz von Adolf Hitler nieder. Ribbentrop steht grüßend vor dem Sarg.
2	2. Staatsakt für Hans von Tschammer und Osten in der Neuen Reichskanzlei, Berlin, Deutsches Reich, 1943 Trauerfeier für den verstorbenen Reichssportführer Hans von Tschammer und Osten (gestorben 25.03.1943) im Mosaiksaal der Neuen Reichskanzlei in Berlin: der aufgebahrte Sarg ist mit einer Hakenkreuzfahne, einem Säbel und einer Uniformmütze bedeckt. Ehrenposten stehen neben dem Sarg, daneben stehen Fahnenträger der Sturmabteilung (SA). Die Orden und Ehrenzeichen des Verstorbenen werden von Ehrenposten auf Samtkissen getragen (ein Sportler mit dem Abzeichen des Nationalsozialistischen Reichsbunds für Leibesübungen (NSRL) und einem Ritterkreuz hält Ehrenwache); die Kränze des finnischen Olympischen Komitees, des ungarischen Gesandten, des schwedischen Gesandten und von Göring; Propagandaminister Joseph Goebbels hält eine Rede; die Trauergäste; Goebbels und Ehrenposten der SS legen einen Kranz von Adolf Hitler nieder; Goebbels steht mit Hitlergruß vor dem Sarg. Vor der Neuen Reichskanzlei ist eine Ehrenformation der Waffen-SS angetreten; eine Fahne auf Halbmast; der Sarg ist auf einem von Pferden gezogenen Geschützwagen mit einer leFH 18 gebettet; die Zuschauer am Straßenrand grüßen den Trauerzug; der Trauerzug bewegt sich in Richtung des Brandenburger Tors.
3	3. U-Boot-Stützpunkt an der Kanalküste, Frankreich, 1943 Marinesoldaten stehen am Ufer und betrachten ein einlaufendes Unterseeboot (U-Boot); am Kai ist eine Ehrenformation der Marine angetreten. Zwei Boote liegen nebeneinander an der Hafenmauer. Kapitänleutnant Gerhard Bielig auf dem „U 177“. Ein Tank-U-Boot läuft ein, die Besatzung ist an Deck angetreten; der Kommandant wird mit einem Strauß Blumen begrüßt. Ein Kran hievt Torpedos von einem Lkw auf das Deck eines U-Bootes; Artilleriemunition stapelt sich auf dem Boot und wird unter Deck gebracht; Kanister, Flaschen und Kisten mit Lebensmitteln werden verstaut. Vorpostenboote fahren im Geleit von Zerstörern und suchen die Fahrrinne nach Minen ab; Suchgeräte werden am Heck ausgelegt; Beobachter halten Ausschau nach feindlichen Flugzeugen; eine Vierlingsflak an Deck. Ein U-Boot läuft aus; mehrere Boote auf hoher See.
4	4. Der Oberbefehlshaber der italienischen 8. Armee Italo Gariboldi zu Besuch bei Hitler, Berlin, Deutsches Reich, 1943 Generaloberst Italo Gariboldi und dessen Begleitung werden am 01.04.43 von Adolf Hitler empfangen; Begrüßung durch Generalfeldmarschall Wilhelm Keitel; Hitler verleiht Gariboldi das Ritterkreuz.
5	5. König Boris von Bulgarien zu Besuch bei Hitler auf dem Berghof, Obersalzberg, Deutsches Reich, 1943 Eine Ehrenformation der SS ist auf der Terrasse angetreten; Adolf Hitler tritt aus dem Gebäude; Meldung durch den Führer den Kommandeur der Ehrenformation. Ein Wagen fährt heran; der bulgarische König Boris III. steigt aus und wird von Hitler und dessen Gefolge begrüßt. Eintritt ins Haus. Eine Besprechung zwischen König Boris, Hitler, Keitel, und Ribbentrop. Hitler begleitet König Boris zu seinem Wagen.
6	6. Kämpfe zwischen Ladogasee und Ilmensee, Russische Sozialistische Föderative Sowjetrepublik, Sowjetunion, 1943 Kartentrick: Nördliche Ostfront, Leningrad, Schlüsselburg, Narwa, Luga, Nowgorod, Ladogasee, Ilmensee, Msta, Wolchow. Kommandeur der 28. Jägerdivision Generalleutnant Johann Sinnhuber auf einem Pferdeschlitten; Sinnhuber besichtigt eine Artilleriestellung; Soldaten bauen Spanische Reiter aus Holz und Stacheldraht; sie werden vor die Stellungen gerollt. Blick aus deutschen Stellungen über die Newa; Artillerie (leFH 18) beschießt sowjetische Stellungen am anderen Ufer; Einschläge; Gegenfeuer setzt ein; Soldaten rennen in Deckung; ein brennender Unterstand wird mit Eimern gelöscht. Die deutschen Stellungen weiter südlich: Artillerie (15 cm schwere Feldhaubitze sFH 18 und 21 cm Mörser Mrs 18) beschießt das Vorfeld; Einschläge; 8,8 cm Flak feuert; die Besatzung getroffener Panzer wird mit einem MG bekämpft; leichte Flak feuert; zerstörte Panzer (T-34); ein General der Luftwaffe zeichnet Soldaten einer Flakeinheit mit dem Eisernen Kreuz aus. Grenadiere wenden ihre Tarnkleidung von weiß auf dunkel und gehen zum Angriff vor; StuG III rollen vor; Vorrücken durch waldiges Gelände. Ein StuG III feuert auf einen rauchenden T-34; Infanterie geht vor; verwundete deutsche Soldaten werden zurückgebracht; viele gefallene sowjetische Soldaten. Zerstörte sowjetische Unterstände und Geschütze; Kriegsgefangene werden aus ihren Stellungen getrieben und abgeführt; Kriegsgefangene tragen einen Verwundeten auf einer Trage. Deutsche Soldaten bei einer Kampfpause; weiteres Vordringen durch den Wald; Gefechte; MG-Feuer; ein Kriegsgefangener wird abgeführt und durchsucht; Blick vom Waldrand auf die gegnerische Linie; Feuer mit MG und Infanteriewaffen u.a. Scharfschütze; sowjetische Soldaten bewegen sich in ihren Stellungen; Halbkettenfahrzeuge ziehen 8,8 cm Flak nach vorne; diese eröffnet das Feuer auf die feindliche Stellung; Einschläge. Sowjetische Kampfflugzeuge greifen an: Bombeneinschläge in der Nähe; ein MG zur Flugabwehr; zwei Halbkettenfahrzeuge mit Vierlingsflak. Flak feuert; ein sowjetischer Flieger stürzt brennend ab; brennende Trümmer auf einem Feld. Sturzkampfflugzeuge (Stuka Junkers Ju 87) starten auf einem Flugfeld; Stuka im Flug; Bombenabwurf im Sturzflug. Artilleriefeuer; Einschläge.
