chapter	content
1	1. Führerhauptquartier, Gedenken an verstorbenen König, Ostpreußen, Deutsches Reich, 1943. Zum Tode von König Boris von Bulgarien: Aufnahmen vom letzten Besuch König Boris' von Bulgarien im Führerhauptquartier: Hitler, Keitel und Ribbentrop erwarten die Ankunft des Flugzeugs auf dem Flugplatz. König Boris verlässt das Flugzeug, der König begrüßt Hitler, Keitel und Ribbentrop. Anschließende Autofahrt zum Hauptquartier. Hitler und König Boris betreten das Hauptquartier. Rückfahrt zum Flughafen. König Boris verabschiedet sich von Ribbentrop, Keitel und Hitler.
2	2. Staatsbegräbnis, Sofia, Bulgarien, 1943. Trauerfeierlichkeiten zum Tode König Boris: Trauerzug der bulgarischen Bevölkerung in den Straßen Sofias. Der aufgebahrte Leichnam. Trauernde Menschen ziehen an der Bahre des Königs Boris von Bulgarien vorüber. Die Witwe, Königin Anna, betritt tief verschleiert die Kathedrale. Die deutsche Abordnung zu den Trauerfeierlichkeiten mit Großadmiral Erich Raeder, Generalfeldmarschall Wilhelm Keitel und Staatssekretär im Auswärtigen Amt Gustav Adolf Steengracht von Moyland. Der deutsche Trauerkranz. Die Witwe, Königin Anna, mit zwei Kindern darunter König Simeon II. Trauerzug durch die Straßen Sofias. Das Pferd des verstorbenen Königs.
3	3. Hitler-Jugend, Deutsches Reich, 1943. ´Tag der Wehrertüchtigung´. Hitlerjugend bei militärischer Ausbildung. Vorführung einer Löschübung, Verbinden eines Verwundeten. Junge beim Schrauben an einem Motorrad. Schießübungen mit Gewehren. Jungen besteigen Motorboote, Aufnahmen der Fahrt über einen kleinen Fluss.
4	4. Seekrieg, Fujiyama, Japan, 1943. Deutscher Hilfskreuzer ´Thor´ auf der Fahrt in einen japanischen Hafen. Offiziere der japanischen Kriegsmarine kommen an Bord. Begrüßung beim Kommandanten Günter Gumbrich. Deutsche Matrosen von Bord auf Landurlaub. Besuch an einem Schrein, Sprecher: ‚Ehrung der gefallenen japanischen Helden‘. Die Besatzung beim Bummel, beim Rudern. Blick auf den Fujiyama, die deutsche und die japanische Fahne, im Hintergrund der Fujiyama.
5	5. Kampfhandlungen, Sowjetunion, 1943. Kartentrick: Westliches Russland. (Sprecher:) Die NSKK-Transportbrigade ´Speer´ beim Transport deutscher Infanterieeinheiten mit Lastwagen. Lkw-Kolonnen auf der Fahrt über staubige oder verschlammte Straßen. Schwer mit Ausrüstung beladene Soldaten. Infanterie marschiert hintereinander. Divisionsablösung. Junge Soldaten. Ausheben von Schützengräben mit Schaufel und Spitzhacke. Soldaten der Waffen-SS verzehren einen Kürbis. Obst wird in einen Stahlhelm geschüttet. Verpflegungspause. Spielende Katzen. Ausgebaute Unterstände. Blick aus dem Schützengraben auf einen zerschossenen Wald. Soldaten stehen im Graben, der bis zu den Knöcheln unter Wasser steht. Artilleriefeuer. Einschläge nahe dem Graben. Deutsches schweres Artilleriegeschütz wird feuerbereit gemacht. Deutsche Artilleriegeschütze verschiedener Kaliber feuern. Einschläge am Horizont. Ein Sturmgeschütz III mit Geäst zur Tarnung und Infanterieschutz fährt auf einen Wald zu. Flugzeuge am Himmel. Deutsche Flakartillerie feuert. Ein Gefechtsleitstand. Schießen mit Maschinengewehr und Gewehren. Sprecher: ‚Diese Kampfbilder sind die letzten Aufnahmen des vor dem Feinde gefallenen Kriegsberichters Sengewitz.‘ Deutsche Infanterie schießt mit Gewehren und einem MG. Menschen am Horizont. Sprecher: ‚Da hinten die Sowjets!‘ Werfen einer Handgranate. Deutsche Soldaten marschieren über eine Wiese. Stukas (Ju 87). Ein Stuka mit eingebauter Filmkamera an der Tragfläche. Bombenabwürfe aus der Sicht des Flugzeugs. Explosionen, Rauchwolken. Einsatz von Nebelwerfern. Flakartillerie beschießt Ziele. Schwere Rauchwolken über dem Kampfgebiet. Gefallene Soldaten. Zerstörte sowjetische Panzer und Waffen. Kriegsgefangene tragen Verwundete zum Hauptverbandsplatz. Generalleutnant Graf von Schwerin überreicht dem verwundeten Feldwebel Bredemeyer im Lazarett das Ritterkreuz. SS-Unterscharführer Thaler, der als erster Panzerfahrer mit dem Ritterkreuz ausgezeichnet worden war, in einem Panzer.
6	6. Verteidigung Italiens, Brennerpass, Kalabrien, Italien, 1943. Der Oberbefehlshaber Süd Generalfeldmarschall Albert Kesselring begrüßt einige Offiziere und Soldaten. Beobachtungsstelle an der Küste, deutsche Soldaten, Artilleriegeschütze in Feuerbereitschaft und beim Säubern. Soldaten beim Weintraubenessen. Von Süddeutschland aus werden deutsche Streitkräfte auf den Marsch nach Italien gebracht. Eine Kolonne von Kradfahrern. Straßenschild: ‚Brenner und Stubaital‘. Ein Zug beladen mit Panzern, Panzerspähwagen und Fahrzeugen. Fahrt deutscher Fahrzeuge mit Waffen und Nachschub über Gebirgsstraßen. Italienische Grenzstation. Kinder fahren auf Fahrzeugen mit. Italienische (Tiroler) Bevölkerung begrüßt die Soldaten mit Obst und Getränken. Jubelnde Menschen. Eine Kolonne von Panzerartillerie-Selbstfahrlafetten fährt über schmale Gebirgsstraßen. Sturmgeschütze auf engen, staubigen Straßen.
