chapter	content
1	1. Boxsport, unbekannter Ort, Deutsches Reich, 1943/1944. Szenen aus einem Boxkampf in einer deutschen Großstadt (Sprecher), Zuschauer.
2	"2. NS-Auslandsorganisation, Paris, Frankreich, 1943/1944. Kundgebung französischer Faschisten in Paris. Großer Schriftzug vor einer Tribüne: ""Europe unie contre le bolshevisme"". Am Rednerpult sprechen der (Sprecher:) „französische Sicherheitschef“ Joseph Darnand und der Politiker Marcel Déat (kein O-Ton). Unter den Zuhörern auch französische Freiwillige (SS-Männer) (Sprecher)."
3	3. Balkanfeldzug, unbekannter Ort, 1943/1944. „Serbische Freiwillige“ (Sprecher) bei der Ausbildung. Kolonne von Soldaten in Uniform marschieren vorbei. Soldaten laufen eine Hügelflanke hinauf, im Gelände.
4	4. Partisanen, Jugoslawien, 1943/1944. (Sprecher:) „In Bosnien, bolschewistische Banden terrorisieren die Bevölkerung und stecken Dörfer in Brand.“ Landschaft mit Rauchsäulen. Brennende Dörfer in einem Tal. Waffen-SS-Offiziere bei einer Einsatzbesprechung an einer Karte. „Vernichtungskampf“ (Sprecher). Berittene Einheit. Wasserschutzpolizei auf einem Fluss. Panzer rollen über eine Bergstraße. SS-Männer gehen durch morastiges Gelände. Benzinkanister als improvisierte Heizquelle in einem VW-Kübelwagen. Panzerfahrzeuge verschiedener Bauart und Feldgeschütze beschießen Ziele. Einschläge in bewaldetem Gebiet. „Der Anführer einer Kosakeneinheit“ (Sprecher), Mann mit Pelzmütze. Sturmgeschütze. Halbkettenfahrzeuge. Kriegsgefangene. Flugblätter: Eine stilisierte Person mit Fahne, Schriftzug „Deutsche Soldaten!“ mit Text. Männer in kauernder Haltung. (Sprecher:) „Gesindel“.
5	"5. Rückzug, Sowjetunion, 1943/1944. Kartentrick: Nordwestliche Sowjetunion und Finnland, Barents-See, Murmanische Küste, Murmansk, Salla, Helsinki, Leningrad, Finnischer Meerb[usen]. Wegweiser in schneebedeckter Landschaft: ""Murmansk 45 km, Köln 3300 km, Frankfurt 3200 km, München 3250 km, Berlin 2750 km“. Pferdeschlitten und LKW fahren über eine schmale Straße. Schild: „Achtung! Feindeinsicht! 100 m Abstand.“ Tarnung, Äste an zwischen Masten gespannten Seilen, wird von Männern über der Straße angebracht. Eine Seilbahn mit Loren. Beladene Pferdeschlitten auf einer verschneiten Straße. Brennholz wird aufgestapelt. Deutsche Soldaten in einem „Finnenzelt“ (Sprecher), einer liest die Zeitung ""Wacht im Norden"", Radio. Schwestern des Deutschen Roten Kreuzes nähen „Schneehemden“ (Sprecher). Ein Mann mit Papier-Fähnchen: „Lebertran“. Aus einer Flasche mit Papierwimpel „Lebertran“ wird eine Flüssigkeit in einen Löffel geschüttet. Männer führen einen Löffel zum Mund und verziehen anschließend das Gesicht. Generaloberst Eduard Dietl bei einer Besprechung, Inspektion von Grabenstellungen und beim Verteilen von Schachteln (Sprecher: „Zigaretten“) an Soldaten."
6	"6. Rückzug, Sebesh/Newel, Sowjetunion, 1943/1944. Kartentrick: Westliche Sowjetunion, Moskau, Witebsk, Kiew, Dnjepropetrowsk, Dnjepr, Asowsches Meer. Entladung von Panzerartillerie „Wespe“ von einem Zug. LKW-Kolonne auf einer Straße. (Sprecher:) ""Ostlandschlepper"" Kettenfahrzeuge mit angehängten Panzerabwehrkanonen (PAK). Zahlreiche Panzer Typ ""Panther"" rollen über Pisten. Sonnenuntergang. Ein starker Scheinwerfer leuchtet das nächtliche Gelände ab. Wegweiser: ""Sebesh 65 km (nach rechts), Newel 49 km (nach links)"". Panzerfahrzeuge, Sturmgeschütz, Halbkettenfahrzeuge auf einer Straße im Winter. Transportflugzeuge Ju 52. Tiger-Panzer. Pferdefuhrwerk. Soldaten marschieren in Winterbekleidung vorbei. Artilleriegeschütz feuert. Große Menge leerer Kartuschen in einem Sammellager."
7	7. Rückzug, Kirowograd, Sowjetunion, 1943/1944. (Sprecher:) „Im heiß umkämpften Raum um Kirowograd.“ Deutsche Panzer und Soldaten auf einer verschneiten Wiese. Sowjetische Kriegsgefangene werden befragt. Tigerpanzer stehen auf einer verschneiten Wiese. Gefecht. Deutscher Scharfschütze. Zerstörter sowjetische Panzer. Überreichung des Ritterkreuzes an den Obergefreiten [Rudolf] Albust durch Generaloberst Hans [Wolfgang?] Reinhard(?). Im „Raum Leningrad“ (Sprecher) wird der Oberfeldwebel [Martin] Hrustak mit dem Ritterkreuz ausgezeichnet. Deutsche Grabenstellungen. Artillerie (Flak 8,8 cm) feuert. Nebelwerfer auf Halbkettenfahrzeugen feuern Salven. Detonationen am Horizont.
8	"8. Seekrieg, unbekannter Ort, Indischer Ozean/Ostafrika (?), 1943/1944. Korvettenkapitän Robert Gyzae blickt durch ein Fernglas. Wachposten auf dem Turm eines U-Bootes auf See. (Sprecher:) „Diese Aufnahmen sind die Fortsetzung unseres, vor einigen Wochen gegebenen, Berichts.“ Ein Mann legt das „Tauchgerät“ (Beschriftung) und metallen aussehende Sandalen an und steigt an der Bordwand des U-Bootes ins Meer unter Wasser. Männer an Deck halten eine Leine. Der Taucher steigt aus den Fluten. Männer steigen durch ein enges Loch in den Rumpf des U-Bootes. Ein aufgetauchtes U-Boot (Sprecher: „Versorgungs-U-Boot“) nähert sich. (Sprecher:) „Pünktlich zur festgesetzten Stunde treffen sich die beiden U-Boote mitten im Indischen Ozean, tausende von Meilen von der deutschen Heimat entfernt.“ Ein aufgetauchtes U-Boot mit Männern an Deck. Ein Mann mit Sprachrohr. Ein U-Boot fährt längsseits. Ein Mann hämmert auf ein Ventil. Schlauchboot mit zwei Personen. Aus einem Schlauchboot werden Kisten bei Seegang an Deck des U-Bootes gewuchtet. (Sprecher:) „Ein Kranker wird zum Versorgungsboot übergesetzt.“ Zwei Männer in einem Schlauchboot. Lösen eines Schlauches vom Ventil, eine große Menge Flüssigkeit ergießt sich auf Deck. Ein Mann (Sprecher: „Smutje“) mit Brotlaiben. Ein Torpedo wird eingefettet. Torpedorohre. Ein Mann duscht sich. Matrosen essen Suppe in beengtem Raum. Männer im Ausguck eines U-Bootes. (Sprecher:) „Wir nähern uns der Ostküste Afrikas.“ Ein Sehrohr ragt aus dem Wasser. Gyzae blickt durch ein Sehrohr, ein Schiff in einem Fadenkreuz. Männer auf ihren Stationen hektisch am Bedienen der Geräte. Berechnungen (Sprecher: „Vorhaltewinkel“) auf einer Streichholzschachtel. Männer hantieren an Hebeln. Torpedoabschuss (Sprecher). Gysae und ein Mann blicken auf eine Taschenuhr. Detonationsgeräusch. Ein Schiff. Ein Rettungsboot im Fadenkreuz. Das Schiff ""Radames"" [Versenkung war am 25. Mai 1941] versinkt im Meer."
