chapter	content
1	"1. Komponist, Deutsches Reich, 1944. (Sprecher:) „Der 75-jährige Komponist Professor [Hans] Pfitzner dirigiert die Ouvertüre zu seiner Oper ""Das Käthchen von Heilbronn"".“ Orchester. Nahaufnahme von Pfitzner, dirigierend."
2	2. Galopprennen, Berlin-Karlshorst, Deutsches Reich, 1944 (Sprecher:) „Im ausbombardierten Berlin zur Eröffnung der Galopprennsaison haben sich zehntausende von Berlinern in Berlin-Karlshorst eingefunden.“ Menschenmenge am Rande der Rennbahn. Pferde mit Reiter verlassen den Sattelplatz (Sprecher). Start zum Osterpreisrennen. Rennszenen. Mitfiebernde Zuschauer, darunter auch der Polizeipräsident von Berlin, Wolf Heinrich Graf von Helldorff.
3	"3. Rundfunk, Berlin, Deutsches Reich, 1944. (Sprecher:) „In diesem Jahrzehnt ist der Rundfunk zum Künder des politischen Wortes geworden.“ Der Berliner Funkturm, davor zwei Statuen. Haus des Rundfunks in der Masurenallee von außen. Tontechniker bei der Arbeit. Zeitung ""Das Reich"" Nr. 16 vom 16. April 1944 mit der Überschrift: ""Unbeugsam, Einig, Bereit"". Darunter ein Bild Hitlers mit einem General. Rau am Sprechertisch geht das Manuskript durch. Verlesung des Goebbels-Leitartikels aus der Wochenzeitung ""Das Reich"" durch den Chefsprecher des Großdeutschen Rundfunks Rau (Original-Ton)."
4	4. Ausbildung, Ruhrgebiet, Deutsches Reich, 1944. (Sprecher:) „In einer Zeche des Ruhrgebietes unterzieht sich der Nachwuchs im Bergbau den Prüfungen des Reichsberufswettkampfes der deutschen Jugend.“ Ein Tor zu einer Industrieanlage, darüber ein Schild mit Hakenkreuzen und Aufschrift: „Gauwettkampfstätte des Kriegsberufswettkampfes 1944 Wettkampfgruppe Bergbau“. Schüler im Klassenraum, im Laboratorium, beim Stollenbau im Schacht. Männer mit Unterlagen. Überreichung der Urkunden: Kinder in der Uniform der Hitler-Jugend nehmen Schriftstücke entgegen und halten diese in die Kamera.
5	5. Wiege, Karelien, Finnland, Sowjetunion, Deutsches Reich, 1944. Baumfällen in einem verschneiten Wald in Karelien (Sprecher). Männer basteln in einer Blockhütte eine Kinderwiege. Oberjäger Otto Schmetzer erhält eine Wiege für seinen Nachwuchs. Übergabeurkunde: „Den glücklichen Eltern Oberjäger Otto Schmetzer und Frau zur Geburt ihres [Name des Kindes] meine und meiner Division herzliche Glückwünsche.“ Ein General überreicht ihm die Wiege. Verabschiedung zum Heimaturlaub. Fahrt im Urlauberzug. Der Schwiegervater (Sprecher) holt Otto Schmetzer vom Bahnhof ab. Kutschfahrt. Begrüßung der Ehefrau und des Babys. Baby wird in die Wiege gelegt.
6	6. Montecassino, Italien, 1944. Kartentrick: Frankreich, Italien: Venedig, Genua, Rom, Aprilia, Nettuno, Cassino, Korsika, Sardinien. „Weitere Filmdokumente vom Kampf deutscher Soldaten im Raum von Cassino.“ Ruinen des Klosters. Zerstörte Kunstwerke. Zerstörte Gebäude im Tal. (Sprecher:) „Kraterfelder vor Cassino.“ Landschaft mit Kreisen von Einschlagskratern. Beobachtungen am Scherenfernrohr. Artillerie Einschläge an einem Hang. Flak 8,8 cm feuert. Panzer am Fuße eines Berges. Fallschirmjäger mit Haftmine. Wracks von Panzern. Explosionen auf einem Bergrücken. Fallschirmjäger bewegen sich in den Ruinen eines zusammengestürzten Gebäudes. Explosionen, Rauch. Granatwerfer und Maschinengewehr feuern.
7	"7. Gigant, Sowjetunion, 1944. Kartentrick: Südwestliche Sowjetunion, Charkow, Dnjepropetrowsk, Odessa, Kertsch, Simeferopol, Jalta, Asowsches Meer, Dnjepr, Bug. Eine Me 323 „Gigant“ wird auf einem verschneiten Feldflughafen von Schnee befreit. Rumpfbemalung: Ein Elefant mit Flügeln du Koffer im Rüssel. Verladen von Munitionskisten und Granaten. Beladung von Flugzeugen vom Typ ""Gigant "" mit einem schweren Motor, Auto und Geschütz. Verladung „einer ganzen Kompanie“ (Sprecher) in den Lufttransporter. Soldaten mit Marschgepäck. Soldaten ohne Marschgepäck stehen Schlange, um eine Me 323 über eine Seitentür zu besteigen. Soldaten mit Gepäck besteigen eine Me 323. Start und Flug einer Me 323. Zusammentreffen mit einem großen Verband von Ju 52 Transportflugzeugen."
8	8. Geleitzug, Schwarzes Meer, Sowjetunion, 1944. (Sprecher:) „Geleitzüge der Kriegsmarine bringen Nachschub für die Krim-Kämpfer.“ Schiffe auf See. Flakstellung an Land wird bemannt. Explosionen. Flak verschiedener Kaliber feuert. Lichtsignale. Ankunft des Geleitzuges. Entladen.
9	9. Entsatz, Kowel, Sowjetunion, 1944. Kartentrick: Südwestliche Sowjetunion, Kowel, Lemberg, Tarnopol, Odessa. (Sprecher:) „Die am 16. März in Kowel eingeschlossene deutsche Besatzung wurde nach 21-tägigen Kampf durch das kameradschaftliche Zusammenwirken aller Waffen befreit.“ He 111 mit laufenden Motoren auf einem verschneiten Feldflughafen. Einsatzbesprechung. „Versorgungsbomben“ werden an Tragflächen montiert. He 111 im Flug. Blick auf die Piloten und aus dem Cockpit auf die anderen Flugzeuge. Bordschütze. Abwurf von Versorgungsbomben mit Fallschirmen (Blick aus dem Flugzeug und vom Boden). Soldaten öffnen die Behälter und holen Granaten heraus. Bilder aus der Stadt Kowel (Sprecher). Soldaten schaufeln bei Eisenbahngleisen. Ein Soldatengrab zwischen Eisenbahngleisen mit Schild (unleserlich) und Helm. Essen, Versorgung von Verwundeten, Beobachten zwischen den Bahnanlagen. Ein Panzerzug rollt auf Gleisen und feuert mit einem Geschützturm. Maschinengewehr feuert. Panzer und Soldaten im Schneetreiben. Flugzeuge am Himmel. Ein Verwundeter wird getragen. Flugzeuge (JU 87?) am Himmel. Luftangriff mit Sturzkampfbombern JU 87. Pilot am Steuerknüppel. Der Führer der Einsatzaktion, Oberstleutnant Ernst-Wilhelm Hoffmann, bei einer Einsatzbesprechung. Panzer IV und Panther. Halbkettenfahrzeuge. Bemalung auf einem Panzerturm: Aufrecht stehender Bär mit Schriftzug „Bärenführer“. Panzer feuern. Infanterie und Panzer im Gefecht in einer Siedlung. Brennende Gebäude. Zerstörte Panzer Typ „Sherman“. Gefangene sowjetische Soldaten, brennendes Haus. Halbketten-LKW auf verschlammter Straße. SS-Generalleutnant Herbert Gille begrüßt Oberstleutnant Hoffmann. Waffen-SS-Soldaten und Infanteristen der Wehrmacht rauchend im Gespräch. Der MG-Schütze Gefreiter Max Zastrow erhält das Ritterkreuz. Soldaten beglückwünschen ihn.
