start	end	text	start_mm:ss	end_mm:ss
12500	20100	Anlässlich des 2600-jährigen Bestehens des japanischen Kaiserhauses fand in Tokio eine große Kaiserparade statt.	00:12	00:20
22510	24510	Der Kaiser auf seinem traditionellen Schimmel.	00:22	00:24
24970	51420	Der Infanterie die Luftwaffe.	00:24	00:51
79570	83210	Zum Schluss zogen Reiterregimenter an dem obersten Befehlshaber vorüber.	01:19	01:23
88850	92210	Der Vesuv zeigte in letzter Zeit verstärkte Tätigkeit.	01:28	01:32
93130	99770	An der östlichen Wand des Eruptionskegels hat sich eine Öffnung gebildet, aus der sich glühende Lava ins Tal ergießt.	01:33	01:39
99970	123130	Trotz des Krieges setzt das faschistische Italien die Regulierungsarbeiten am Tessin am Ausgang des Lago Maggiore fort.	01:39	02:03
123770	130730	Um die Wasserkräfte des Tessin, der dem Lago Maggiore entströmt, auszuwerten, wird ein riesiges Elektrizitätswerk errichtet.	02:03	02:10
133840	138180	Mithilfe von Caissons werden die Unterwasserarbeiten an den Fundamenten ausgeführt.	02:13	02:18
142060	144200	Wieder geht ein Eimer voll Erde nach oben.	02:22	02:24
153990	156050	Dampfrahmen für das Einsetzen der Pfähle.	02:33	02:36
156230	163400	Ein Teil der Anlage ist heute bereits fertiggestellt.	02:36	02:43
163860	170960	Dieser Kanal führt das Wasser zu den Turbinen.	02:43	02:50
176810	177650	Ein Maschinenhaus.	02:56	02:57
183550	187350	Aufbruch in einem Auffanglager der deutschen Rückwanderer aus Bessarabien.	03:03	03:07
187970	193170	Nach einem kurzen Aufenthalt in diesem Lager, das noch auf rumänischem Boden liegt, geht es nun heim ins Reich.	03:07	03:13
193710	215720	Eine Dorfgemeinschaft in der Ostmark begrüßt die Heimgekehrten.	03:13	03:35
216440	218520	Und hier ein Übergangslager in Bayern.	03:36	03:38
218520	225570	Die Rückkehrer verbleiben hier bis zu ihrer baldigen, endgültigen Ansiedlung.	03:38	03:45
241310	242930	In der Halle des Unterkunftshauses.	04:01	04:02
271100	275420	Die Bessarabiendeutschen haben ihre alten Volksbräuche auch in der Fremde treu bewahrt.	04:31	04:35
275420	296020	Für die diesjährige Weihnachtssammlung des Kriegswinterhilfswerkes wurden insgesamt 30 Millionen Kasperlefiguren hergestellt.	04:35	04:56
296660	300760	Über 70 Eisenbahnwagen musste man für die Heranschaffung des Holzes einsetzen.	04:56	05:00
304470	305990	Das sollen einmal Könige werden.	05:04	05:05
307170	310710	Die kleinen Holzkörper werden für die Anbringung der Arme durchbohrt.	05:07	05:10
310710	320430	In der Malerwerkstatt. 30.000 Kilo Lack wurden für das Bemalen der Figuren benötigt.	05:10	05:20
323360	325100	Die Sache bekommt allmählich Gesicht.	05:23	05:25
330310	332230	Und hier ein König, seinen Hermelin.	05:30	05:32
338480	340740	Einer der vielen Kasperle erhält seine Arme.	05:38	05:40
341340	345340	Für diese Arbeit brauchte man insgesamt 6.000 Kilometer Faden.	05:41	05:45
345340	376340	Die Berliner Eissportsaison wurde mit einem Schaulaufen des Weltmeisterpaares Maxi und Ernst Bayer eröffnet.	05:45	06:16
385480	388500	8.000 Soldaten waren Gäste dieser Veranstaltung.	06:25	06:28
388500	439800	Wurde unter dem Titel Ein Maler erlebt die Reichsautobahn eine Aquarellausstellung des Malers Ernst Huber eröffnet.	06:28	07:19
449410	453490	Reichsminister Dr. Todt und Reichsleiter Baldur von Schirach beim ersten Rundgang.	07:29	07:33
464880	467920	Die neue Nibelungenbrücke in Linz geht ihrer Verlendung entgegen.	07:44	07:47
467920	474120	Nach ihrer Fertigstellung wird sie einen wichtigen Donauübergang auf dem Wege München-Wien darstellen.	07:47	07:54
474700	477820	Die Gesamtlänge der Brücke beträgt 250 Meter.	07:54	07:57
493830	497090	Auch Kriegsgefangene wurden für die Bauarbeiten mit herangezogen.	08:13	08:17
497190	523570	In einem Kriegsgefangenenlager im besetzten französischen Gebiet.	08:17	08:43
524030	528790	Ein großer Teil der Kriegsgefangenen wird zum Arbeitseinsatz nach Deutschland in Marsch gesetzt.	08:44	08:48
528790	532790	Sie sollen hier dazu beitragen, den Mangel an Arbeitskräften auszugleichen.	08:48	08:52
578140	579720	Verpflegung für die Fahrt.	09:38	09:39
588020	591580	Auch in den besetzten Gebieten sind zahlreiche Arbeiterkolonnen eingesetzt.	09:48	09:51
592060	594100	Hier Aufräumungsarbeiten in Rouen.	09:52	09:54
594100	599660	Alle Straßen, die mit Schuttmassen bedeckt waren, sind jetzt für den Verkehr wieder freigemacht worden.	09:54	09:59
613140	616320	Wo Einsturzgefahr besteht, werden die Mauerreste beseitigt.	10:13	10:16
625090	629250	Die von den Franzosen zerstörte Brücke von Saint-Marmé auf der Strecke Paris-Dijon	10:25	10:29
629250	634970	wurde in der Rekordzeit von fünf Wochen unter Einsatz von Kriegsgefangenen provisorisch wiederhergestellt	10:29	10:34
634970	636570	und jetzt für den Verkehr freigegeben.	10:34	10:36
636570	642550	Die Fahrzeit Paris-Marseille wird dadurch um über sechs Stunden verringert.	10:36	10:42
642970	658770	Im Generalgouvernement wird das von den einstigen polnischen Machthabern	10:42	10:58
658770	661890	völlig vernachlässigte Straßennetz verbessert und ausgebaut.	10:58	11:01
684590	689150	Mit Hilfe von Spezialmaschinen wird in kurzer Zeit eine feste Straßendecke geschaffen.	11:24	11:29
689750	692910	Als Arbeitskräfte sind hauptsächlich Polen eingesetzt.	11:29	11:32
701980	708780	Durch die Initiative unserer Wehrmacht werden damit immer neue Gebiete erschlossen die früher für den Verkehr nur schwer erreichbar waren.	11:41	11:48
709260	714000	Deutsche Ordnung und Sauberkeit haben mit der polnischen Wirtschaft endgültig Schluss gemacht.	11:49	11:54
720490	724410	Putzstunde bei einer Radfahrtschwadron unseres Heeres im besetzten Gebiet.	12:00	12:04
724910	727550	Auch das Stahlroß muss immer blitzsauber sein.	12:04	12:07
735820	737260	Zum Radappell angetreten.	12:15	12:17
751610	753530	Dieser Verdunkelungsschlitz stimmt nicht ganz.	12:31	12:33
759060	760480	Abmarsch zur Übung.	12:39	12:40
769070	770890	Bei unserer Infanterie draußen.	12:49	12:50
771110	774530	Auch zwischen den großen Entscheidungen muss jeder einzelne Mann	12:51	12:54
774530	779030	durch ständige Übungen für große Aufgaben einsatzbereit gehalten werden.	12:54	12:59
779130	781670	Eine Sturmbatterie greift in den Kampf ein.	12:59	13:01
782270	785970	Sie hat die Aufgabe, besonders schwer befestigte Stellungen des Feindes	13:02	13:05
785970	789170	von der vordersten Linie aus artilleristisch zu bekämpfen.	13:05	13:09
796670	799870	Immer weiter arbeitet sich die Infanterie an den Gegner heran.	13:16	13:19
819130	822550	Zukas belegen schwere Bunker, die den Weg sperren mit ihren Bomben.	13:39	13:42
822930	857430	Der Pionierstoßtrupp hat sich bis an die feindliche Bunkerlinie herangekämpft	13:42	14:17
857430	859150	und setzt Flammenwerfer ein.	14:17	14:19
859150	908910	Die Bunkerlinie hinaus wird der Kampf weiter in das feindliche Gelände getragen.	14:19	15:08
916470	917950	Kampf gegen England.	15:16	15:17
918850	924030	Auf einem Feldflughafen in Nordfrankreich wird ein deutsches Kampfgeschwader mit Bomben beladen.	15:18	15:24
938030	940810	Die Bordwaffen sind noch einmal überprüft worden.	15:38	15:40
940810	954620	Das sind Bomben schwersten Kalibers, wie sie in den letzten Wehrmachtsberichten wiederholt erwähnt wurden.	15:40	15:54
957680	960200	Mit einem Trecker werden sie zu den Maschinen gebracht.	15:57	16:00
992590	995510	Die Aufhängung erfolgt mit Hilfe eines Flaschenzuges.	16:32	16:35
995510	1010980	Hart frei zum Vergeltungsflug gegen London.	16:35	16:50
1021720	1025640	Welle auf Welle nimmt ihren Weg nach der Hauptstadt Englands.	17:01	17:05
1026000	1076480	Nach einem schweren deutschen Luftangriff.	17:06	17:56
1076860	1099970	Diese sensationellen Aufnahmen sind von amerikanischen und neutralen Kameramännern gedreht.	17:56	18:19
1100650	1106570	Sie gelangten zum Teil sogar unter Umgehung der scharfen englischen Zensurbehörden über Amerika in unseren Besitz	18:20	18:26
1106570	1111170	und zeigen, wie es in London bereits vor acht Wochen ausgesehen hat.	18:26	18:31
1111170	1115990	Ganze Gebäudekomplexe der Wirtschafts- und Rüstungsindustrie stehen in hellen Flammen.	18:31	18:35
1116910	1126610	Diese Bilder sind die schlagendste Widerlegung der ständigen Lügenmeldungen des Reuterbüros dass noch heute die Welt Glauben machen will, es gebe in London keine nennenswerten Schäden	18:36	18:46
1126610	1131070	und das öffentliche Leben gehe hier nach wie vor seinen ungestörten Gang.	18:46	18:51
1131950	1137590	Feuerwehr und Selbstschutzkräfte müssen pausenlos gegen die Wirkung der deutschen Bomben eingesetzt werden.	18:51	18:57
1137590	1177800	Die Uhr des Parlamentsgebäudes, auch sie war damals schon von Splittern getroffen.	18:57	19:37
1178200	1209340	Mr. Churchill, der Mann, der das alles auf dem Gewissen hat.	19:38	20:09
1236060	1243580	So sahen schon vor acht Wochen die Docks von London aus von denen bekanntlich heute noch das englische Luftfahrtministerium behauptet,	20:36	20:43
1243980	1246020	sie seien kaum beschädigt.	20:43	20:46
1246020	1272600	So sahen schon vor acht Wochen die	20:46	21:12
