start	end	text	start_mm:ss	end_mm:ss
22960	30780	Der Führer empfing auf dem Berghof die jugoslawischen Staatsmänner Ministerpräsident Sveczkowicz und den Außenminister Zinsa Markowicz.	00:22	00:30
46620	51820	Die Besprechungen wurden im Geiste der traditionellen freundschaftlichen Beziehungen der beiden Nationen geführt.	00:46	00:51
58970	68150	Auf der Ordensburg Sonthofen im Allgäu führte Reichsorganisationsleiter Dr. Lai den neuen Burgkommandanten Dr. Hupfauer in sein Amt ein.	00:58	01:08
68590	75740	Adolf Hitler-Schüler, die während des Krieges auf der Burg erzogen werden, wohnen dem Festakt bei.	01:08	01:15
76960	79940	Der weitaus größte Teil der Ordensjunker steht heute an der Front.	01:16	01:19
81460	85100	Dr. Lai übergibt dem neuen Burgkommandanten die Fahne der Burg.	01:21	01:25
95710	99550	Und hier ein paar Bilder aus dem Leben der Adolf Hitler-Schüler auf der Ordensburg.	01:35	01:39
99910	101070	Abendliches Konzert.	01:39	01:41
107090	108150	Musischer Unterricht.	01:47	01:48
118000	122140	Die Jungen, die hier erzogen werden, stellen eine Auslese der deutschen Jugend dar.	01:58	02:02
122140	125120	Ihre Erziehung ist außerordentlich vielseitig.	02:02	02:05
125120	127680	In der Kunstschmiede.	02:05	02:07
135900	139080	In den Schlafseelen herrscht peinlichste Ordnung und Sauberkeit.	02:15	02:19
139440	172600	Großappell des werktätigen Berlin im Sportpalast.	02:19	02:52
173100	178360	Die Betriebsfahnen der DAF rücken in die historische Kampfstätte der Berliner Nationalsozialisten ein.	02:53	02:58
178980	182840	Voran die goldenen Fahnen der vom Führer ausgezeichneten Musterbetriebe.	02:58	03:02
182840	206960	Reichsminister Dr. Goebbels, der zu den Berliner Werktätigen sprach, setzte sich in seiner Rede mit der Dummheit und Lächerlichkeit der englischen Lügenpropaganda auseinander, die auf die Zuhörer erheiternd wirkte.	03:02	03:26
206960	227120	Im weiteren Verlauf seiner Rede führte Dr. Goebbels aus, dass dieser Krieg ein dem deutschen Volk aufgezwungener Kampf um seinen Lebensraum und damit um seine Existenz sei.	03:26	03:47
227700	235420	Das deutsche Volk habe ebenfalls ein Recht, die gleiche Befriedigung seiner Lebensnotwendigkeiten zu fordern wie England oder andere Nationen.	03:47	03:55
235560	260560	Der Chef der dänischen Ordnungspolizei, der zurzeit in Deutschland weilt, legte am Berliner Polizeiehrenmal am Horst-Wessel-Platz einen Kranz nieder.	03:55	04:20
260560	285240	Am Tage der deutschen Polizei stellten sich die Hüter der Ordnung und Sicherheit in den Dienst des Kriegswinterhilfswerkes.	04:20	04:45
285780	292020	In Berlin begann der Ehrentag der Polizei, der einen außerordentlichen Sammelerfolg hatte, mit dem großen Morgenruf.	04:45	04:52
300450	303250	Vorführung von Diensthunden in den Straßen Berlins.	05:00	05:03
332000	339880	Auf dem Exerzierplatz der alten Berliner Maikäferkaserne, die jetzt als Polizeihunterkunft dient, hatte die Schupo einen großen Vergnügungspark aufgebaut.	05:32	05:39
348060	352080	Alles dreht sich, alles bewegt sich für das Kriegswinterhilfswerk.	05:48	05:52
360270	367030	Überall folgte die Bevölkerung in hellen Scharen dem Rufe der Polizei, die damit aufs Neue ihre Volkstümlichkeit bewies.	06:00	06:07
372380	374560	Im kurhessischen Städtchen Trendelburg.	06:12	06:14
375980	385760	Wer empfandt der U-Boot-Besatzung des Korfettenkapitänen von Stockhausen, findet heute Mittag 13.38 Uhr am Bahnhof Trendelburg statt.	06:15	06:25
385760	389460	Die gesamte Einwohnerschaft wird dazu eingeladen.	06:25	06:29
391880	399640	Trendelburg, die Heimatstadt des Ritterkreuzträgers Korvettenkapitän von Stockhausen, schmückt sich zum Empfang der tapferen Unterseebootmänner.	06:31	06:39
399640	406280	Die Burg im Hintergrund, die im 14. Jahrhundert erbaut wurde, ist der Stammsitz der Familie Stockhausen.	06:39	06:46
415080	419780	Oberst von Stockhausen, der Vater des Unterseebootkommandanten, begrüßt als erster seinen Sohn.	06:55	06:59
419780	446130	Kapitän von Stockhausen meldet seinem Vater die Mannschaft seines Unterseebootes.	06:59	07:26
448190	489180	Auf der Burg, ein Geschenk für den Kommandanten, ein Bild seiner Heimat.	07:28	08:09
493070	494970	Liebesgaben für die tapfere Besatzung.	08:13	08:14
521480	525540	Kapitän von Stockhausen berichtet seinen Angehörigen über seine letzte Feindfahrt.	08:41	08:45
525540	533500	Und das Wechrudernde der Boote, der zweite Schuss, der ging vorne in den vorderen Laderaum, der Dampfer lag schon tief.	08:45	08:53
534240	539320	Und dadurch entwich vorne aus dem Laderaum die Luftblase, auf der der Dampfer scheinbar noch schwamm.	08:54	08:59
539720	545040	Jedenfalls sackte er daraufhin sehr schnell weg und stellte sich hochkant.	08:59	09:05
545040	547540	Wir haben dann noch ein paar Schuss in die Brücke gegeben, die Brücke brannte.	09:05	09:07
548360	560560	Und der Artillerieoffzieher, der seine Leute sehr gut in der Hand hat, der sagte, rief runter kehrt schnell den letzten Schuss ins Geschütz hinten rein, weil das Geschütz gerade so schön hochkant auf dem Heck zu sehen war.	09:08	09:20
561080	566920	Und das Geschütz wurde geladen, es wurde geschossen und tatsächlich der Schuss saß im Kanon und warf das ganze Kanon aus dem Bord.	09:21	09:26
567080	573020	Das fiel mit einer großen Sprengsäule raus und der Dampfer ging daraufhin, aber blitzartig auf Tiefe.	09:27	09:33
573020	582920	Man konnte sehen, hinten die Schraube, die drehte sich noch. Anschließend war dann die Stelle glatt und nur noch das Rettungsboot mit einem Fluss auf dem auch Leute saßen, das schwamm da hinten rum.	09:33	09:42
584580	589920	Am Abend treffen sich die Unterseeboot-Männer mit der Bevölkerung von Trendelburg zu ein paar frohen Stunden.	09:44	09:49
589920	643200	In den Siemens-Werken wurde in diesen Tagen der größte bisher gebaute Wasserkraftgenerator fertiggestellt der für ein Großkraftwerk am Yalu-Fluss in Manchukuo bestimmt ist.	09:49	10:43
643820	648440	Die Polräder, die die Wasserkraft in elektrische Energie umwandeln, werden eingesetzt.	10:43	10:48
649480	652920	Dieser Generator wird 136.000 PS liefern.	10:49	10:52
653560	656920	Sein Gesamtgewicht beträgt 1.200.000 Kilo.	10:53	10:56
657560	660800	Für seinen Transport werden 50 Güterwagen benötigt.	10:57	11:00
661240	666270	Die Generatorwelle auf der Drehbank.	11:01	11:06
666850	669990	Sie muss auf ein Hundertstel Millimeter genau bearbeitet werden.	11:06	11:09
669990	673730	Der Dreher kontrolliert immer wieder die Genauigkeit seiner Arbeit.	11:09	11:13
674190	688850	Die Tragkonstruktion wird aufgesetzt.	11:14	11:28
689330	691570	Sie hat die Polräder und die Turbine zu tragen.	11:29	11:31
712110	718730	Dieses Schnittmodell zeigt die Arbeitsweise der riesigen Maschine von der vier Stück nach Manchukuo exportiert werden.	11:52	11:58
723270	728730	Besuch bei Professor Arno Brecker, dem Schöpfer hervorragendster Werke neuer deutscher Plastik.	12:03	12:08
729330	737610	Aus der kleinen Tonskizze entsteht in immer größeren Maßstäben das Bildwerk Die Bereitschaft dessen endgültige Höhe 15 Meter betragen wird.	12:09	12:17
754670	757590	Die Einzelteile des Werkes werden immer wieder überarbeitet.	12:34	12:37
769600	775980	Dieses Relief, Aufbruch zum Kampf, ist für einen Monumentalbau an der neuen Berliner Nord-Südachse bestimmt.	12:49	12:55
776740	782440	Im Rahmen der Neugestaltung Berlins und Nürnbergs erhielt Professor Brecker eine Reihe großer Aufträge.	12:56	13:02
809740	814080	Die Anmut, eine der Plastiken für den runden Saal der neuen Reichskanzlei.	13:29	13:34
814080	824950	Deutsche Flieger auf einer Pariser Eisbahn.	13:34	13:44
825530	828570	Nach dem Dienst eine verdiente Erholung und Freude.	13:45	13:48
875710	882490	In Cortina d'Ampezzo, dem berühmten italienischen Wintersportplatz, wurden die diesjährigen Ski-Weltmeisterschaften ausgetragen.	14:35	14:42
886980	888560	Ein Marsch der Nationen.	14:46	14:48
889300	894460	13 Länder nahmen an den Kämpfen teil, die trotz des Krieges eine hervorragende Besetzung aufwiesen.	14:49	14:54
895120	899700	Die deutschen Skiläufer konnten von den 12 Weltmeisterschaften sechs für sich erobern.	14:55	14:59
899700	905440	In der Punktwertung steht Deutschland an der Spitze, weit vor allen anderen beteiligten Nationen.	14:59	15:05
933400	937520	Maxi und Ernst Bayer zeigen im Rahmen der Wettkämpfe ihre Meisterkür.	15:33	15:37
969710	970550	Spezialsprunglauf.	16:09	16:10
970950	973090	Sieger Vodovieto, Finnland.	16:10	16:13
985190	985790	Torlauf.	16:25	16:25
986310	991130	Hier teilten sich Albert Pfeiffer, Deutschland, und Chironi, Italien, die Weltmeisterschaft.	16:26	16:31
991470	1003220	Abfahrtslauf gewann Josef Jennewein, Deutschland.	16:31	16:43
1040750	1042550	Sanitätsübung im Hochgebirge.	17:20	17:22
1042550	1045730	Der Dienst der Sanitätssoldaten ist hier besonders schwierig.	17:22	17:25
1046310	1047550	Ein Verwundeter wird geborgen.	17:26	17:27
1048050	1051370	Mit Hilfe von Skiern und Spezialgeräten wird eine Trage zusammengestellt.	17:28	17:31
1052010	1055590	Der Verwundete muss so schnell wie möglich ärztlicher Hilfe zugeführt werden.	17:32	17:35
1070680	1071700	Kommt an, freut an.	17:50	17:51
1084310	1086230	Abseilen über einen steilen Hang.	18:04	18:06
1086650	1106750	Das ist runter.	18:06	18:26
1107110	1108490	Das habe ich hier aufgenommen.	18:27	18:28
1108850	1156360	Ein deutsches Fernkampfflugzeug kehrt vom Feindflug zurück.	18:28	19:16
1156760	1157620	Die Maschine wackelt.	19:16	19:17
1157620	1159420	Der Einsatz war erfolgreich.	19:17	19:19
1174630	1177750	Die Mannschaft wird von ihren Kameraden freudig begrüßt.	19:34	19:37
1186480	1190180	Der Frachter, den wir mit unseren Bomben belegten, krachte nur so auseinander.	19:46	19:50
1190780	1196720	Die Siegesliste am Rumpf der Maschine wird vervollständigt.	19:50	19:56
1198680	1202620	Wieder wird ein deutscher Fernkampfbomber zum Feindflug klargemacht.	19:58	20:02
1226150	1229150	Der Funker bleibt in dauernder Verbindung mit dem Heimathafen.	20:26	20:29
1250620	1252740	Stunde um Stunde wehrt der Flug.	20:50	20:52
1253200	1255180	Es geht an der englischen Ostküste entlang.	20:53	20:55
1255180	1269830	Englische Frachter und Tanker.	20:55	21:09
1270270	1278300	Der Größte wird angegriffen.	21:10	21:18
1278620	1305660	Punkt an die Heimat.	21:18	21:45
1306060	1307900	Die ersten Bomben haben gesessen.	21:46	21:47
1308100	1321430	Das nächste Ziel ist ein englischer Wasserflughafen.	21:48	22:01
1322050	1324230	Der Bordschütze macht seine Waffe fertig.	22:02	22:04
1324690	1333310	Die englischen Maschinen.	22:04	22:13
1333730	1345810	Stoß auf Feuerstoß trifft sein Ziel.	22:13	22:25
1370740	1373440	Tauchtes englisches Unterseeboot wird angegriffen.	22:50	22:53
1373440	1390460	Waffe und Kriegsmarine machen England reif für die Stunde der Entscheidung.	22:53	23:10
