start	end	text	start_mm:ss	end_mm:ss
12660	18500	Zeit vergeht, sie ist nicht wieder einzuholen. Nur wer sie nutzt, kann sie als seinen Verbündeten betrachten.	00:12	00:18
19000	22520	Unsere Feinde behaupten immer, die Zeit arbeite allein für sie.	00:19	00:22
23160	26000	Diese Darstellung zeigt ihnen, wie es in Wirklichkeit aussieht.	00:23	00:26
26700	30760	Zu Beginn des großen Ringens wurde in einem Feldzug von wenigen Wochen Polen zerschlagen.	00:26	00:30
31400	35800	Die erste Etappe des Krieges war damit beendet. Der Rücken für den Kampf im Westen frei.	00:31	00:35
35800	42800	Nach dem Einmarsch in Dänemark und der Besetzung Norwegens wurden die Niederlande, Belgien und Frankreich niedergeworfen.	00:35	00:42
44260	47000	Im Südosten Jugoslawien und Griechenland überrannt.	00:44	00:47
48240	56520	Deutschland und seine Verbündeten hatten damit wichtigste Rohstoffgebiete in Besitz genommen die allein schon einen bedeutenden Zuwachs für unsere Waffenschmieden darstellten.	00:48	00:56
57380	62060	Nun begann die Abwehr des von der Sowjetunion gegen das Reich geplanten Angriffes.	00:57	01:02
62060	72080	Es galt der bolschewistischen Weltbedrohung entgegenzutreten und die sowjetischen Stoßarmeen die ganz Europa überfluten und seine alte Kultur vernichten sollten, zu zerschlagen.	01:02	01:12
73200	78060	Im unvergleichlichen Siegeszug wurden die riesigen Armeen der Sowjets immer weiter nach Osten zurückgeworfen.	01:13	01:18
79860	87920	Nach 15 Monaten Krieg gegen die Sowjetunion ist ein Raum gewonnen, der so groß ist wie Großdeutschland, Frankreich und England zusammengenommen.	01:19	01:27
87920	92960	Hier einige Vergleiche für die riesige Weite der Kampfräume im Osten.	01:27	01:32
94300	101240	Die Entfernung von der Murmannküste bis zum Elbrus entspricht etwa der Luftlinie von Riga bis nach Madrid.	01:34	01:41
102520	110540	Die Strecke von Leningrad bis nach Brest-Litovsk entspricht etwa der Entfernung von Berlin bis Paris.	01:42	01:50
110540	119430	Die Entfernung von Brest-Litovsk nach Stalingrad ist ungefähr so groß wie die Luftlinie von Lübeck nach Neapel.	01:50	01:59
121820	124420	Wirtschaftlich am bedeutendsten ist der südrussische Raum.	02:01	02:04
125560	128900	Hier eroberten unsere Soldaten die fruchtbarsten Gebiete Europas.	02:05	02:08
129460	132580	Der Reichtum dieses Raumes an Bodenschätzen aller Art ist fast unerschöpflich.	02:09	02:12
134840	136580	Hier zum Beispiel die wichtigsten Kohlevorkommen.	02:14	02:16
136580	141600	Die jährliche Förderung dieser Gruben betrug vor dem Krieg rund 100 Millionen Tonnen.	02:16	02:21
142100	152100	Bedenken Sie, die gesamte Förderung des Altreichs betrug im Jahr 1938 186 Millionen Tonnen die der Sowjetunion etwa 170 Millionen Tonnen.	02:22	02:32
153040	160060	Die 100 Millionen Tonnen, die früher aus den von uns eroberten Gruben gefördert wurden entsprechen also 60 Prozent der gesamten sowjetischen Förderung.	02:33	02:40
160760	164000	Die Sowjetunion hat damit schon jetzt gewaltige Mengen an Kohle verloren.	02:40	02:44
164000	171360	Wie der Führer in seiner großen Rede sagte, wird es die Aufgabe der deutschen Organisation sein diese Bodenschätze für uns nutzbar zu machen.	02:44	02:51
172680	178340	Diese von unseren Armeen in Besitz genommenen Erzgruben lieferten jährlich 25 Millionen Tonnen bester Eisenerze.	02:52	02:58
178780	179700	Auch hierfür ein Vergleich.	02:58	02:59
180320	184940	Im Altreich wurden 1938 insgesamt 12,4 Millionen Tonnen Erz gefördert.	03:00	03:04
185360	187980	In der Sowjetunion dagegen 33 Millionen Tonnen.	03:05	03:07
187980	195280	Durch die Eroberung der südrussischen Erzgruben kamen also rund 75 Prozent der gesamten sowjetischen Vorkriegsförderung in unsere Hand.	03:07	03:15
195840	197460	Und nun die Manganvorkommen.	03:15	03:17
198020	204320	Hier bei Nikopol liegen sehr bedeutende sowjetische Gruben dieses für die Eisen- und Stahlherstellung unentbehrlichen Rohstoffes.	03:18	03:24
204860	206960	Sie erbrachten jährlich etwa eine Million Tonnen.	03:24	03:26
207620	212660	Der hieraus allmählich anfallende Zuwachs an Manganerzen ist für die deutsche Industrie besonders bedeutungsvoll.	03:27	03:32
212660	218600	Denn in ganz Deutschland wurden im Jahre 1939 nur 40.000 Tonnen Mangan gefördert.	03:32	03:38
219060	222020	In der Sowjetunion dagegen 2,8 Millionen Tonnen.	03:39	03:42
222720	227240	Die Bolschewisten mussten also bei ihren Rückzügen über 30 Prozent ihrer Manganerze aufgeben.	03:42	03:47
228660	233940	Es wird lediglich eine Frage der Zeit und der Organisation sein, auch diese Reichtümer für uns nutzbar zu machen.	03:48	03:53
234980	239060	Die bereits in unserer Hand befindlichen oder im Bereich unserer Waffen liegenden Ölfelder	03:54	03:59
239060	242220	spielen ebenfalls eine entscheidende Rolle für den Fortgang des Krieges.	03:59	04:02
242660	244380	Hier das Gebiet von Maikop.	04:02	04:04
244800	248400	Die jährliche Förderung daraus betrug bisher 2,2 Millionen Tonnen Öl.	04:04	04:08
249420	253080	Das Gebiet von Grosny, um das zurzeit noch gekämpft wird.	04:09	04:13
253660	256600	Bisher wurden hier jährlich 2,6 Millionen Tonnen gefördert.	04:13	04:16
257220	260040	Um ihnen von diesen Mengen einen Begriff zu geben, ein Vergleich.	04:17	04:20
260780	264300	Rumänien fördert im Jahr durchschnittlich 6 Millionen Tonnen Öl.	04:20	04:24
264920	268840	Die Sowjetunion erreichte früher eine Gesamtförderung von 30 Millionen Tonnen.	04:24	04:28
268840	272960	Maikop und Grosny lieferten davon ca. 15 Prozent.	04:28	04:32
274140	280540	Die Ausnutzung der bisher von uns eroberten Ölfelder erleichtert uns insbesondere den wirtschaftlichen Wiederaufbau in den besetzten Ostgebieten	04:34	04:40
280540	284540	und durch Verkürzung der Transportwege die Versorgung unserer Wehrmacht.	04:40	04:44
284540	293960	Für die Sowjets fällt hierbei schwer ins Gewicht, dass der Abtransport des Baku-Öls durch die deutschen Erfolge im Raum der Volga und des Kaukasus jetzt weitgehend beeinträchtigt ist.	04:44	04:53
294580	297800	In Baku wurden bisher rund 22 Millionen Tonnen Öl gefördert.	04:54	04:57
298240	300540	Das sind ca. 70 Prozent der sowjetischen Gesamtproduktion.	04:58	05:00
300540	307200	Einzigartig wie der Reichtum an Boden schätzen, ist auch die Fruchtbarkeit des südrussischen Raumes.	05:00	05:07
308220	311400	Hier liegen vor allem die bedeutendsten Getreidegebiete der Sowjetunion.	05:08	05:11
311900	318680	Sie erbrachten früher einen Überschuss von etwa 10 Millionen Tonnen, mit denen die Zuschussgebiete Zentralrusslands, vor allem Moskau, versorgt wurden.	05:11	05:18
319260	321420	Diese Zuschüsse fehlen jetzt den Bolschewisten.	05:19	05:21
323680	327740	Was dieser Raum für unsere Ernährung bedeutet, zeigt dieser Vergleich.	05:23	05:27
327740	334300	Großdeutschland hat auf einer Ackerfläche von 27 Millionen Hektar 90 Millionen Menschen zu ernähren.	05:27	05:34
334860	343600	Dagegen umfassen allein die von unseren Soldaten bisher eroberten Ostgebiete eine Ackerfläche von 62 Millionen Hektar, von denen nur rund 60 Millionen Menschen lebten.	05:34	05:43
344860	349820	In den besessenen Ostgebieten steht also jedem Einwohner das Dreifache an Ackerfläche zur Verfügung.	05:44	05:49
350420	355240	Dieser Reichtum an Boden wird im Laufe der kommenden Jahre für die Ernährung Europas planmäßig erschlossen.	05:50	05:55
355240	364340	Dieses fruchtbare und an Bodenschätzen so reiche Land wurde in schwersten Kämpfen den Sowjets abgerungen, die damit unersetzliche Verluste erlitten haben.	05:55	06:04
364780	368020	Die Ernährung der Sowjetunion ist schon heute aufs Schwerste gefährdet.	06:04	06:08
368560	372060	Auch die sowjetische Industrie hat ihre wertvollsten Rohstoffgebiete verloren.	06:08	06:12
374300	380640	Unsere Soldaten haben damit einen Raum gewonnen, durch den unsere Ernährungs- und Rohstoffbasis wesentlich erweitert worden ist.	06:14	06:20
381060	384460	Die Zeit arbeitet jetzt nur noch für Deutschland.	06:21	06:24
384460	435170	Der Reichsmarschall empfing in seinem Hauptquartier General Ayranov, den Oberbefehlshaber der bulgarischen Luftwaffe.	06:24	07:15
452250	458510	Auch der Oberbefehlshaber der ungarischen Luftwaffe, Feldmarschall Leutnant Rakoschi, stattete dem Reichsmarschall einen Besuch ab.	07:32	07:38
459090	463190	Feldmarschall Leutnant Rakoschi besichtigte verschiedene deutsche Luftwaffeneinrichtungen.	07:39	07:43
494120	495940	Im höchsten Norden der Ostfront.	08:14	08:15
501150	506710	Männer der Organisation TOT haben in den wenigen Monaten des nordischen Sommers die Eismeerstraße weiter ausgebaut.	08:21	08:26
506710	509590	Das Baumaterial wird in mühevollster Arbeit gewonnen.	08:26	08:29
514170	517690	Mächtige Blöcke werden aus dem Fels herausgesprengt und zerkleinert.	08:34	08:37
518090	520190	Sie dienen als Unterbau für die neuen Straßen.	08:38	08:40
532000	534040	Das ist die Straße zur Murmannfront.	08:52	08:54
541680	544060	Auch eine Reihe neuer Brücken musste gebaut werden.	09:01	09:04
544300	547460	Sie machen den Nachschub vom zeitraubenden Fährbetrieb unabhängig.	09:04	09:07
547460	561550	Die Lappenbevölkerung sieht interessiert zu, wie das früher unwegsame Land durch die Hilfsorganisationen unserer Wehrmacht immer mehr dem Verkehr erschlossen wird.	09:07	09:21
562050	565190	Die starke Abnutzung der Eismeerstraße verlangt ständige Pflege.	09:22	09:25
576500	582440	Auf einem Feldflugplatz im hohen Norden starten in der Dämmerung deutsche Kampfverbände zum Angriff auf Archangelsk.	09:36	09:42
583020	587120	Archangelsk und Murmannsk sind die bedeutendsten Nachschubhäfen für die Sowjets im Norden.	09:43	09:47
587120	612520	Der Mondschein begünstigt den Angriff.	09:47	10:12
613900	616460	Über Archangelsk, die ersten Bomben haben gesessen.	10:13	10:16
624220	626100	Unter uns große Flächenbrände.	10:24	10:26
634460	636060	Im Raum von Stalingrad.	10:34	10:36
640670	643610	In der Nähe des Don wird eine neue Vollbahnstrecke gebaut.	10:40	10:43
643950	648530	Sie soll den Verkehr auf der Straße entlasten und die Heranführung des Nachschubs beschleunigen.	10:43	10:48
650660	653600	Durch ein hügeliges Gelände wird ein Durchstich ausgesprengt.	10:50	10:53
654080	685320	Anderen Punkten muss der Bahndamm kilometerweit aufgeschüttet werden.	10:54	11:25
685320	698430	Über die fertiggestellte Strecke wird weiteres Baumaterial herangeführt.	11:25	11:38
707080	711320	Mit jedem Tag stößt der Schienenstrang um ein großes Stück weiter nach Osten vor.	11:47	11:51
712340	747200	Tal wird durch eine Holzkonstruktion überbrückt.	11:52	12:27
752180	754320	Fahrt zur Front von Stalingrad.	12:32	12:34
763440	768400	In den Ruinen der eroberten Stadtteile säubern unsere Stoßtrupps in planmäßigem Vorgehen	12:43	12:48
768400	771940	die letzten unterirdisch angelegten Widerstandsnester der Bolschewisten.	12:48	12:51
786890	789310	Konzentrischer Einsatz von schweren Infanteriewaffen.	13:06	13:09
789310	804050	Unsere Stuka schlagen mit großer Treffsicherheit immer neue Breschen in den Feind.	13:09	13:24
804450	852740	Hochwolken stehen über dem Schlachtfeld von Stalingrad auf dem seit Wochen die schwersten Äußerkämpfe dieses Krieges toben.	13:24	14:12
855980	856480	An der Kaukasusfront.	14:15	14:16
861280	864340	Deutsche Panzerkampfwagen im Vorstoß westlich des Terek.	14:21	14:24
864760	869800	Ihr Ziel ist der Raum von Nalchik, wo die Sowjets eine neue starke Kampflinie ausgebaut haben.	14:24	14:29
870360	907760	Unsere Stuka brechen der Panzerspitze voraus besonders schwere Bunkerlinien der Sowjets auf.	14:30	15:07
907760	918340	Bomben, Einschläge dicht vor unseren Panzern.	15:07	15:18
918740	923430	Artillerie im Kampf vor Nalchik.	15:18	15:23
923430	946800	Munitionslager getroffen.	15:23	15:46
956430	960310	Rumänische Gebirgstruppen dringen mit deutschen Gebirgsjägern in die Stadt ein.	15:56	16:00
967490	970930	Sturmartillerie und Panzerkampfwagen unterstützen die angreifenden Bataillone.	16:07	16:10
994480	995680	Anlagen in der Innenstadt.	16:34	16:35
996200	999640	Fast jedes Haus hat hier Schießscharten und zu Bunkern ausgebaute Keller.	16:36	16:39
1023500	1027240	In den Kämpfen um Nalchik wurden über 7000 Gefangene eingebracht.	17:03	17:07
1027240	1031660	Die deutsch-rumänische Waffenbrüderschaft hat sich wieder hervorragend bewährt.	17:07	17:11
1044220	1046700	Ein deutsches U-Boot auf Feinfahrt im Atlantik.	17:24	17:26
1047200	1051120	Mit einem anderen auf gleichem Kurs fahrenden Boot ist ein Treffpunkt vereinbart worden.	17:27	17:31
1051620	1055380	Ein neuer Zylinderblock für den ausgefallenen Backborddiesel soll übernommen werden.	17:31	17:35
1056000	1057260	Der Treffpunkt ist erreicht.	17:36	17:37
1057520	1059820	Das Boot mit dem Ersatzteil kommt längsseit.	17:37	17:39
1062470	1063350	Eine Leine wird hinübergeschossen.	17:42	17:43
1063350	1069940	Die Verbindung ist hergestellt.	17:43	17:49
1077420	1080100	Der Zylinderblock wiegt über 7 Zentner.	17:57	18:00
1080580	1085120	Das Übernehmen dieser schweren Last erfordert bei der unruhigen See hohes seemännisches Können.	18:00	18:05
1096750	1097590	Es ist geschafft.	18:16	18:17
1098410	1100870	Als Tank wird eine Flasche Sekt hinübergeschickt.	18:18	18:20
1107090	1108070	Gut gekühlt.	18:27	18:28
1124740	1127680	Zunächst geht die Fahrt noch mit einer Maschine weiter.	18:44	18:47
1127680	1134120	Der Ersatzblock wird in 20 Stunden langer, angespannter Arbeit, die auf engstem Raum getan werden muss, montiert.	18:47	18:54
1135140	1154300	Der Diesel läuft wieder.	18:55	19:14
1158650	1161330	Mit dem Sextanten wird der Schiffsort kontrolliert.	19:18	19:21
1164680	1167800	Mit äußerster Kraft geht es einem gemeldeten Geleitzug entgegen.	19:24	19:27
1170940	1172340	Eine Rauchfahne ist gesichtet.	19:30	19:32
1187640	1188920	Das Boot geht auf Tiefe.	19:47	19:48
1206070	1208010	Der Kommandant lässt das Seerohr ausfahren.	20:06	20:08
1213300	1214320	Torpedoklappen auf!	20:13	20:14
1219000	1220180	Torpedoklappen sind auf!	20:19	20:20
1224560	1227060	Der Kommandant macht einen einzelfahrenden Frachter aus.	20:24	20:27
1227360	1227920	Auftauchen!	20:27	20:27
1228860	1231140	Der Einzelfahrer kann nur ein Neutraler sein.	20:28	20:31
1253460	1254520	Schuss vor den Bug!	20:53	20:54
1254520	1261820	Der Frachter hat beigedreht und ein Boot ausgesetzt.	20:54	21:01
1262220	1263960	Der Kapitän überbringt die Schiffspapiere.	21:02	21:03
1270120	1280900	Die Papiere sind einwandfrei.	21:10	21:20
1281460	1283560	Es ist ein Portugiese ohne Bannware.	21:21	21:23
1321620	1324160	Das U-Boot nimmt seinen alten Kurs wieder auf.	22:01	22:04
1342630	1347370	Trotz orkanartiger Herbststürme jagen deutsche U-Boote den Feind überall.	22:22	22:27
1348010	1351110	Und treffen ihn immer wieder mit vernichtenden Schlägen.	22:28	22:31
1351110	1364090	Untertitelung im Auftrag des Stadichs	22:31	22:44
1364090	1368650	Untertitelung im Auftrag des concealmentublade	22:44	22:48
