start	end	text	start_mm:ss	end_mm:ss
63250	66890	Werkhallen und Büros wird ununterbrochen für die Front gearbeitet.	01:03	01:06
68470	72490	Fliegeralarm. Ein Teil der hier tätigen Männer gehört der Heimatflag an.	01:08	01:12
73150	105840	Die Männer eilen sofort an ihre Geschütze, stärkt die Abwehrfront gegen feindliche Luftangriffe ohne Beeinträchtigung der Rüstungsarbeiten.	01:13	01:45
106500	109760	Die Männer gelten während des Einsatzes als Wehrmachtsangehörige.	01:46	01:49
110440	116240	Jede Batterie wird von einem erfahrenen Flak-Offizier geführt, dem ein kleiner Batteriestab von aktiven Soldaten zur Verfügung steht.	01:50	01:56
116240	130100	Ein 16-jähriger Hitlerjunge als Richtschütze. Er trägt bereits für mehrere Abschüsse das Eiserne Kreuz.	01:56	02:10
146280	148880	Bei unseren Truppen an der französischen Mittelmeerküste.	02:26	02:28
155410	161070	Die Besetzung der Küstengebiete wird planmäßig fortgesetzt. Immer neue Verbände rücken in ihre befohlenen Abschnitte.	02:35	02:41
162050	164510	Hier ein motorisierter Verband auf dem Marsch an die Riviera.	02:42	02:44
165830	191880	Die Küste ist erreicht.	02:45	03:11
193240	201690	Schwere Haubitzen werden in Stellung gebracht.	03:13	03:21
201690	208940	In Marseille.	03:21	03:28
219660	222800	Plak-Artillerie sichert den Hafen gegen feindliche Luftangriffe.	03:39	03:42
223200	234280	Eisenbahnflag.	03:43	03:54
243360	246040	Die französischen Soldaten tun ihren Dienst weiter.	04:03	04:06
256770	259730	Ein französischer Offizier erklärt die Lage der Hafeneinfahrt.	04:16	04:19
262080	263420	Marsch durch Perpignan.	04:22	04:23
263420	299850	Über die Küstenstraße führt der Weg zur Spanischen Grenze.	04:23	04:59
313320	315920	Herzliche Begrüßung mit den Spanischen Grenzposten.	05:13	05:15
318870	320390	Deutsche Wacht an den Pyrenäen.	05:18	05:20
320830	333420	In wenigen Tagen sind von den deutschen Truppen alle befohlenen Ziele besetzt.	05:20	05:33
333940	337100	Die Küste Südfrankreichs wird sofort in Verteidigungszustand gebracht.	05:33	05:37
337100	355450	Der deutsche Soldat schützt nun auch diesen Abschnitt der europäischen Küste gegen jeden Angriff.	05:37	05:55
364730	365970	Nachschub für Afrika.	06:04	06:05
375460	379540	Deutsche und italienische Transportgeschwader starten zum Flug über das Mittelmeer.	06:15	06:19
380000	399460	Im süditalienischen Hafen werden Frachter beladen.	06:20	06:39
399920	416040	Klar zum Auslaufen.	06:39	06:56
424710	427590	Einheiten der italienischen Kriegsmarine sichern den Verband.	07:04	07:07
431530	435830	Geschwader unserer Luftwaffe überholen auf ihrem Flug nach Afrika den Gleitzug.	07:11	07:15
435830	460570	Alles hält scharf Ausguck.	07:15	07:40
460730	462810	Hier muss ständig mit Feindangriffen gerechnet werden.	07:40	07:42
465730	468310	Eine britische Treibmine wird durch Beschuss unschädlich gemacht.	07:45	07:48
480760	482740	Achtung, englische Torpedo-Flieger.	08:00	08:02
486120	486740	Da kommen sie.	08:06	08:06
490760	491380	Bombenwurf.	08:10	08:11
494000	494980	Gefährlich nahe.	08:14	08:14
495200	505580	Höranflug.	08:15	08:25
505880	520680	Torpedo-Angriff.	08:25	08:40
521120	531730	Zweite Torpedo.	08:41	08:51
538430	538870	Ein dritter.	08:58	08:58
539550	549070	Steuerbord.	08:59	09:09
549070	554470	Der Gleitzug wird durch Einnebelung weiteren Angriffen entzogen.	09:09	09:14
555410	558650	Bei diesem Angriff wurden fünf englische Flugzeuge abgeschossen.	09:15	09:18
562910	577360	Afrika ist erreicht.	09:22	09:37
597060	598640	Der Kampf um Stalingrad.	09:57	09:58
598960	619060	Da belegen Häuserblocks einer Volga mit schweren Bomben.	09:58	10:19
619440	647230	Vernichtender Wucht trifft jede Bombe ihr Ziel.	10:19	10:47
677570	680090	Artillerie zerhämmert die feindlichen Widerstandsnester.	11:17	11:20
680750	733660	Stadwerfer und Maschinengewehre halten einen schweren Bunker nieder.	11:20	12:13
734120	758460	Feuer einstellen.	12:14	12:38
758460	761520	Einige Bolschewiken kommen aus einer zerschlagenen Kellerstellung heraus.	12:38	12:41
779750	781270	Zerstörte Industriewerke.	12:59	13:01
781790	797220	Kampfpause hart am Feind.	13:01	13:17
797640	799620	Die Essenholer haben Verpflegung herangebracht.	13:17	13:19
799620	806920	Die Schlacht um Stalingrad stellt ungeheure Anforderungen an die seelischen und körperlichen Kräfte jedes einzelnen Mannes.	13:19	13:26
816230	818090	An der Küste des Schwarzen Meeres.	13:36	13:38
818090	824630	Ein gemischter Verband der deutschen und rumänischen Kriegsmarine verlässt seinen Stützpunkt.	13:38	13:44
824630	833810	Er hat die Aufgabe, Minensperren zu legen und damit die Bewegungsfreiheit der im Schwarzen Meer noch vorhandenen sowjetischen Seestreichkräfte weiter einzuengen.	13:44	13:53
833810	843580	Die Zünder werden eingesetzt.	13:53	14:03
844660	853190	Deutsche und rumänische Matrosen arbeiten hier kameradschaftlich Seite an Seite.	14:04	14:13
856980	858540	Die Minen sind scharf.	14:16	14:18
867570	870770	In genau berechneten Sekundenabschnitten werden die Minen geworfen.	14:27	14:30
882960	885120	Im Hochkaukasus im Gebiet des Elbrus.	14:42	14:45
885780	889140	Ein Skispehtrupp auf dem Marsch durch die Eisbrüche des Dombai-Ulgen.	14:45	14:49
909840	912420	Schwierige Kletterei am Westgrad des Bergriesen.	15:09	15:12
913000	916140	Nur hervorragende Bergsteiger und Soldaten können hier bestehen.	15:13	15:16
916140	944290	Der Spähtruppführer erklettert einen Vorgipfel in 4100 Meter Höhe.	15:16	15:44
946880	948760	Ein feindlicher Stoßtrupp ist im Anmarsch.	15:46	15:48
949120	951580	Er konnte von unseren tiefer gelegenen Stellungen nicht gesehen werden.	15:49	15:51
952040	953620	Jetzt sind Minuten entscheidend.	15:52	15:53
960410	963450	Rasender Schussfahrt geht es zu den Stellungen auf der Passhöhe hinunter.	16:00	16:03
977630	980950	Waghalsige Übergänge über Eisbrüche ersparen wertvolle Sekunden.	16:17	16:20
1010330	1011930	Raus, feindlicher Stoßtrupp.	16:50	16:51
1020160	1022080	Achtung, Bolschewisten am Passeingang.	17:00	17:02
1025850	1027870	Die alarmierten Gebirgsjäger beziehen ihre Stellungen.	17:05	17:07
1027870	1069050	Der feindliche Stoßtrupp geht flugartig zurück.	17:07	17:49
1071190	1074550	Der Dombai-Ulgen-Pass ist fest in der Hand unserer Gebirgsjäger.	17:51	17:54
