start	end	text	start_mm:ss	end_mm:ss
20780	26860	Feierliche Tagung der Reichsarbeitskammer zum nationalen Feiertag im Mosaiksaal der neuen Reichskanzlei.	00:20	00:26
27620	32900	Die silbernen und goldenen Fahnen der bereits ausgezeichneten deutschen Musterbetriebe umrahmen den Saal.	00:27	00:32
34700	36480	Reichsorganisationsleiter Dr. Leih spricht.	00:34	00:36
37240	42680	In seiner Rede gedachte er vor allem des zehnten Jahrestages der Gründung der deutschen Arbeitsfront.	00:37	00:42
43320	49240	Dr. Leih sagte, wir wollen den geraden Weg des Nationalsozialismus kompromisslos weitergehen.	00:43	00:49
49240	54940	Wir wollen geloben, das Letzte an Kraft und Fähigkeit herzugeben, bis der Sieg unser ist.	00:49	00:54
55480	62920	Die Städten der Arbeit sollen in diesem Krieg die stärksten und festesten Bastionen der Volksgemeinschaft und des unbeugsamen Siegeswillens sein.	00:55	01:02
64420	71480	106 Betriebe werden als Kriegsmusterbetriebe und 13 Betriebe als NS-Musterbetriebe ausgezeichnet.	01:04	01:11
72580	78760	206 Betriebsführer und Arbeiter der deutschen Rüstungsindustrie erhalten das Kriegsverdienstkreuz erster Klasse.	01:12	01:18
79240	95570	Der westfälische Bergmann Konrad Grebe wird als neunter Deutscher zum Pionier der Arbeit ernannt.	01:19	01:35
96570	100570	Konrad Grebe entwickelte ein neuartiges Kohleabbaugerät von besonderer Leistungsfähigkeit.	01:36	01:40
102030	107790	Seine vorbildliche technische Leistung erleichtert dem Bergmann die schwere Arbeit unter Tage.	01:42	01:47
107790	114090	Die Front im Westen.	01:47	01:54
117480	119560	Die jüngste deutsche Mannschaft im Einsatz.	01:57	01:59
120140	124340	Männer des Reichsarbeitsdienstes beim Bau von Feldbefestigungen an der Atlantikküste.	02:00	02:04
125040	126540	Klöcke für Drahtsperren.	02:05	02:06
136770	138030	Laufgräben werden gezogen.	02:16	02:18
148330	151390	Kilometerweit ziehen sich die Drahthindernisse an der Küste entlang.	02:28	02:31
162180	164900	Von hier aus sind es nur 50 Kilometer bis nach England.	02:42	02:44
164900	167440	Zeit zum Mittagessen.	02:44	02:47
175320	177060	Front Varieté im Kleinen.	02:55	02:57
190690	192990	Eine der mächtigen Trutzburgen am Kanal.	03:10	03:12
196580	197980	Hier wohnen die Arbeitsmänner.	03:16	03:17
198460	201980	Sie halfen mit beim Bau des gigantischen Festungswalls aller Zeiten.	03:18	03:21
208910	212410	Reichsarbeitsführer Konstantin Hirl besucht die Einheiten im Westen.	03:28	03:32
212830	215730	Er kann auch die Leistungen seiner Männer mit Recht stolz sein.	03:32	03:35
215730	220230	Eine Radfahrtsfahrt drohen auf dem Marsch durch die Befestigungszone.	03:35	03:40
224720	226580	Ein geschossener Verband britischer Bomber.	03:44	03:46
228280	228920	Fliegerdeckung.	03:48	03:48
233990	235870	Unsere Flak nimmt sofort den Kampf auf.	03:53	03:55
248820	250360	Auch unsere Jäger greifen ein.	04:08	04:10
250720	259240	In riesiger Höhe werden die Briten gestellt.	04:10	04:19
259580	261600	Kondensstreifen zeigen den Verlauf des Kampfes.	04:19	04:21
269910	272350	Einer der Briten Bomber stürzt brennend in die Tiefe.	04:29	04:32
277300	282780	Das Küstengebiet ist an vielen Stellen mit den Trümmern abgeschossener amerikanischer und britischer Bomber übersät.	04:37	04:42
282780	288670	An der Front südöstlich von Leningrad.	04:42	04:48
292030	295450	Auf einer Feldbahn werden frische Truppen nach vorn gebracht.	04:52	04:55
300540	303080	Das ist die Wasserwüste der Wolschow-Sümpfe.	05:00	05:03
303660	307180	Die Schneeschmelze hat weite Landstriche in Seen und Flüsse verwandelt.	05:03	05:07
308400	310680	Transportkähne bringen den Nachschub zu den Stellungen.	05:08	05:10
319800	321580	Fuhren der schweren Winterschlacht.	05:19	05:21
328660	330540	Dritter Kreuzträger Oberleutnant Lang.	05:28	05:30
340250	341870	Heu-Transport auf Floßsäcken.	05:40	05:41
341870	355980	Das Ziel der Fahrt, ein Stützpunkt, der seit Beginn des Tauwetters von seinen Landverbindungen abgeschnitten ist.	05:41	05:55
356540	358540	Alkohol ist hier gut zu gebrauchen.	05:56	05:58
361050	363350	Auch der Küchenunteroffizier benutzt einen Floßsack.	06:01	06:03
368290	371470	Das zähe, wetterharte Panjepferd leistet hier willkommene Hilfe.	06:08	06:11
371470	381460	Auch die Straße ist zum Fluss geworden.	06:11	06:21
385800	387120	Ein vorgeschobener Bunker.	06:25	06:27
387300	392600	Er ist ein kleiner Teil der Hauptkampflinie, die hier nur noch aus einzelnen festen Punkten besteht.	06:27	06:32
406860	410060	Der Divisionskommandeur besichtigt die Stützpunkte seines Abschnittes.	06:46	06:50
410240	413360	Sie müssen trotz der Überschwemmung in jeder Minute einsatzbereit sein.	06:50	06:53
419000	422260	Das Leben in den Sümpfen und Seen des Wolschow-Gebietes ist hart.	06:59	07:02
422260	424860	Tag und Nacht muss gepumpt und geschöpft werden.	07:02	07:04
424860	428080	Wasser und Feuchtigkeit dringen durch alle Ritzen und Fugen.	07:04	07:08
435470	437690	Auf Patrouillengang zwischen den Kampfständen.	07:15	07:17
441370	444270	Rechts und links des behelfsmäßigen Steges droht der Sumpf.	07:21	07:24
450840	452820	Ein Beobachtungsposten wird abgelöst.	07:30	07:32
456990	460130	Vom Hofstand aus reicht der Blick bis weit ins Feindgebiet.	07:36	07:40
467840	469600	Am mittleren Abschnitt der Ostfront.	07:47	07:49
469940	473400	Hier fanden in den letzten Wochen nur Kämpfe von örtlicher Bedeutung statt.	07:49	07:53
475960	478300	Die feindliche Linie wird ständig beobachtet.	07:55	07:58
478460	489350	In den sowjetischen Gräben zeigt sich Bewegung.	07:58	08:09
489350	491490	Ein Fernsprecher gibt die Meldung nach hinten.	08:09	08:11
496180	499360	Im Gefechtsstand einer Batterie werden die Schießwerte ermittelt.	08:16	08:19
503650	505730	Der feindliche Graben wird unter Feuer genommen.	08:23	08:25
506950	540890	Dauert bis in den späten Abend.	08:26	09:00
541650	544670	Nachts greifen sowjetische Bomber unsere Artilleriestellungen an.	09:01	09:04
545090	553920	Brandbomben haben ein Dorf getroffen.	09:05	09:13
562150	563110	Alles packt mit an.	09:22	09:23
563210	564690	Der Brand muss eingedämmt werden.	09:23	09:24
565430	613060	Vorna bergen ihre spärliche Habe.	09:25	10:13
613060	628450	Die Abwehrschlacht in Tunis.	10:13	10:28
631820	638300	Verbände der deutsch-italienischen Panzerarmee ziehen sich in neu ausgebaute Stellungen am Fuße des Atlasgebirges zurück.	10:31	10:38
639380	643600	Es gilt, wichtige Höhenzüge zu besetzen, die die Anmarschwege des Feindes beherrschen.	10:39	10:43
663790	665830	Die letzte deutsche Kolonne ist vorüber.	11:03	11:05
666030	668350	Quer über die Straße wird die neue Stellung gebaut.	11:06	11:08
668610	669730	Sie wird sofort bezogen.	11:08	11:09
669730	694070	Italienische Pioniere heben einen Panzergraben aus.	11:09	11:34
695650	711640	Hinter dem Graben erwarten panzerbrechende Waffen und Granatwerfer den Feind.	11:35	11:51
718750	721150	Panzerspehwagen halten Fühlung mit dem Gegner.	11:58	12:01
727720	731020	Von diesem MG-Stand aus kann eine wichtige Passstraße bestrichen werden.	12:07	12:11
732420	735820	Fallschirmjäger besetzen eine felsige Höhe, die das Land weit überragt.	12:12	12:15
735820	752000	Die Briten und Amerikaner greifen an.	12:15	12:32
752200	757020	Sie versuchen unter Einsatz stärkster Kräfte, die deutsch-italienische Abwehrfront aufzuspalten.	12:32	12:37
757520	762200	Feuer auf die anrückenden Feindkolonnen im Tal.	12:37	12:42
790270	794090	Unsere Stuka sollen mit ihren Bomben feindliche Panzeransammlungen zerschlagen.	13:10	13:14
794610	797010	Die schwer kämpfende Infanterie muss entlastet werden.	13:14	13:17
798810	801290	Jäger starten zur Sicherung der Stuka-Verbände.	13:18	13:21
801850	818600	Dortsangriff!	13:21	13:38
818980	825010	Die Bande ist gelöst!	13:38	13:45
839690	840770	Feindliches Flakfeuer!	13:59	14:00
840890	855820	Der Kampf auf der Erde geht mit aller Härte und Erbitterung weiter.	14:00	14:15
856280	859200	Der Feind rennt mit immer neuen Divisionen gegen unsere Linie an.	14:16	14:19
859660	882600	Heftiges Feuer aller Waffen schlägt dem Feind entgegen.	14:19	14:42
882600	885640	Der entscheidende Erfolg bleibt ihm wieder versagt.	14:42	14:45
888300	925090	Brennende feindliche Panzer!	14:48	15:25
925350	927230	Sie liegen zu Dutzenden vor unseren Stellungen.	15:25	15:27
927790	932210	Allein in einer einzigen Woche wurden 193 dieser Stahlkolosse vernichtet.	15:27	15:32
940760	943020	U-Boot auf Feinfahrt im Atlantik.	15:40	15:43
943580	945720	Wieder ist eine Geleitzugsschlacht beendet.	15:43	15:45
946000	948640	Eins der beteiligten Boote muss neu versorgt werden.	15:46	15:48
951160	952540	Wann ist der Versorger zu erwarten?	15:51	15:52
953100	954940	Nach unserer Berechnung in wenigen Minuten.	15:53	15:54
954940	958640	Da, an der Kim ist er schon.	15:54	15:58
959080	966720	Die Signalverbindung wird aufgenommen.	15:59	16:06
967180	970210	Mach ich machen!	16:07	16:10
975660	977140	Vorbereitungen zur Versorgung.	16:15	16:17
977380	980020	Der leitende Ingenieur und ein Unteroffizier setzen über.	16:17	16:20
982200	982640	Achtung!	16:22	16:22
982760	983340	Festhalten!	16:22	16:23
993640	996020	Die Zwischenventile zum Ölbunker werden geöffnet.	16:33	16:36
1016220	1017800	Förderschläuche verbinden die Boote.	16:56	16:57
1018320	1027060	Wiesen!	16:58	17:07
1027060	1037740	Die Leitung ist angeschlossen.	17:07	17:17
1038600	1039320	Alles klar!	17:18	17:19
1043360	1044420	Das Öl läuft.	17:23	17:24
1049440	1052060	Zu gleicher Zeit werden auch andere Verbrauchsstoffe übernommen.	17:29	17:32
1058380	1060160	Destilliertes Wasser für die Batterien.	17:38	17:40
1061620	1062420	Büchsengemüse.	17:41	17:42
1069060	1070840	Auch Bohnenkaffee gibt es wieder.	17:49	17:50
1074950	1077090	Tubenkäse und Aale.	17:54	17:57
1096200	1099840	Mit dem Ladebaum werden die Torpedos an Bord genommen und ins Boot geführt.	18:16	18:19
1109100	1110500	Die Versorgung ist beendet.	18:29	18:30
1110580	1112000	Der Bordarzt verabschiedet sich.	18:30	18:32
1112000	1113840	Er hat inzwischen die Besatzung betreut.	18:32	18:33
1115920	1119160	Fran und Helle haben neuen Stoff.	18:35	18:39
1119860	1121220	Die Diesel können wieder laufen.	18:39	18:41
1124730	1126630	Ein warmes Bad nach schwerer Arbeit.	18:44	18:46
1131030	1132710	Smutje hat frische Eier bekommen.	18:51	18:52
1132890	1134490	Für jeden gibt es ein paar Eierkuchen.	18:52	18:54
1144920	1146380	Smutjes ganzer Stolz.	19:04	19:06
1161190	1161830	Der Letzte!	19:21	19:21
1165130	1166550	Die Jagd kann weitergehen.	19:25	19:26
1166930	1169110	Die Freiwache unterhält sich auf ihre Weise.	19:26	19:29
1176000	1178500	Auch Fridolin dümpelt im schweren Seegang.	19:36	19:38
1178500	1196140	Ein König geht über Bord.	19:38	19:56
1196140	1203200	Die Sonne verschwindet am Horizont.	19:56	20:03
1204480	1206760	In der Regenböe die Aufbauten eines Frachters.	20:04	20:06
1208160	1208840	Tauchen!	20:08	20:08
1209440	1210320	Auf Gefechtsstation!	20:09	20:10
1227550	1230150	Das Boot pendelt durch und geht auf Seerohrtiefe.	20:27	20:30
1230690	1262020	Im Angriff Seerohr der Britte.	20:30	21:02
1262340	1264660	Es muss ein Nachzüger des verfolgten Gleitzuges sein.	21:02	21:04
1264660	1268000	Die Waffe ist scharf.	21:04	21:08
1271870	1272210	Schuss!	21:11	21:12
1273130	1273810	Schuss!	21:13	21:13
1274450	1275310	Torpedos laufen!	21:14	21:15
1282290	1283830	Einer hat gesessen.	21:22	21:23
1289400	1291240	Beide Maschinen große Fahrt voraus.	21:29	21:31
1291480	1292080	Auftauchen!	21:31	21:32
1292640	1301660	Frachter brennt!	21:32	21:41
1301980	1304140	Seine Fassladung mit Treiböl steht in Flammen.	21:41	21:44
1307880	1310860	Mit hoher Fahrt geht es dem gejagten Geleit weiter nach.	21:47	21:50
1310860	1313740	Die Schlacht im Atlantik geht weiter.	21:50	21:53
1313740	1313780	Die Schlacht im Atlantik geht weiter.	21:53	21:53
